filename,line_number,orig_segments,trans_segments,name,orig_text,trans_text,trans_fixed,trans_orig
adv_dear_kcna_009.txt,71,2,1,千奈,皆様のお顔を見る余裕が\nありませんでしたの。,根本没空看<BR>观众们的表情呢。,,<r\=皆様のお顔を見る余裕が>根本没空看<BR>观众们的表情呢。</r>\r\n
adv_dear_kcna_009.txt,78,2,1,千奈,喜んでいただけたなら……\nよかったですわぁ……,如果能让大家开心……<BR>就太好了呢……,,<r\=喜んでいただけたなら……>如果能让大家开心……<BR>就太好了呢……</r>\r\n
adv_dear_kcna_009.txt,83,2,1,{user},倉本さん。……初めて会った日の\nことを、覚えていますか？,仓本小姐。……还记得<BR>我们初次见面的那天吗？,,<r\=倉本さん。……初めて会った日の>仓本小姐。……还记得<BR>我们初次见面的那天吗？</r>\r\n
adv_dear_kcna_009.txt,90,2,1,{user},半年前、あなたのアイドルとしての\n実力は……ひどいものでした。,半年前，你作为偶像的实力……<BR>实在惨不忍睹。,,<r\=半年前、あなたのアイドルとしての>半年前，你作为偶像的实力……<BR>实在惨不忍睹。</r>\r\n
adv_dear_kcna_009.txt,96,2,1,{user},あの状態からよくぞ……\nここまで成長したものです。,能从那种状态…<BR>成长到现在真是了不起。,,<r\=あの状態からよくぞ……>能从那种状态…<BR>成长到现在真是了不起。</r>\r\n
adv_dear_kcna_009.txt,101,2,1,千奈,えへへっ、\n先生のご指導の賜物ですわっ！,嘿嘿，<BR>这都是老师教导有方呀！,,<r\=えへへっ、>嘿嘿，<BR>这都是老师教导有方呀！</r>\r\n
adv_dear_kcna_009.txt,103,2,1,{user},プロデューサーなのに、\n奇妙な台詞ですが。,身为制作人<BR>这话说得有点奇怪。,,<r\=プロデューサーなのに、>身为制作人<BR>这话说得有点奇怪。</r>\r\n
adv_dear_kcna_009.txt,115,2,1,千奈,わたくしを、本心から\n褒めてくださいますわね。,发自内心地<BR>称赞我呢。,,<r\=わたくしを、本心から>发自内心地<BR>称赞我呢。</r>\r\n
adv_dear_kcna_009.txt,127,2,1,千奈,いつも率直に……\n褒め、叱り、導いてくださった。,总是直率地……<BR>夸奖我，训斥我，引导我。,,<r\=いつも率直に……>总是直率地……<BR>夸奖我，训斥我，引导我。</r>\r\n
adv_dear_kcna_009.txt,133,2,1,千奈,『仕事を果たしたまで』……きっと\nそうおっしゃるのでしょうけれど。,「完成分内工作」……您一定<BR>会这么说吧。,,<r\=『仕事を果たしたまで』……きっと>「完成分内工作」……您一定<BR>会这么说吧。</r>\r\n
adv_dear_kcna_009.txt,135,2,1,千奈,それがどれだけ、わたくしを救い、\n背を押してくださったことか……,但您不知道这对我是多大的救赎<BR>给了我多少前进的勇气……,,<r\=それがどれだけ、わたくしを救い、>但您不知道这对我是多大的救赎<BR>给了我多少前进的勇气……</r>\r\n
adv_dear_kcna_009.txt,151,2,1,千奈,『契約は終わり』だなんて、\nどうかおっしゃらないで。,"请千万不要说什么<BR>""契约已经结束""这样的话。",,"<r\=『契約は終わり』だなんて、>请千万不要说什么<BR>""契约已经结束""这样的话。</r>\r\n"
adv_dear_kcna_009.txt,155,2,1,千奈,ここに戻る前、\nお爺様に会ってきました。,在回到这里之前<BR>我去见了祖父大人。,,<r\=ここに戻る前、>在回到这里之前<BR>我去见了祖父大人。</r>\r\n
adv_dear_kcna_009.txt,157,2,1,千奈,優しく怖いお爺様。少し前まで、\nご意思に逆らうことなんて……,那位温柔又严厉的祖父大人。就在不久前<BR>我还从不敢违抗他的意志……,,<r\=優しく怖いお爺様。少し前まで、>那位温柔又严厉的祖父大人。就在不久前<BR>我还从不敢违抗他的意志……</r>\r\n
adv_dear_kcna_009.txt,163,2,1,千奈,考えもしませんでしたわ。\nですけれど……,连想都不敢想呢。<BR>但是……,,<r\=考えもしませんでしたわ。>连想都不敢想呢。<BR>但是……</r>\r\n
adv_dear_kcna_009.txt,168,2,1,千奈,きっちり認めさせてきましたわ！　\nわたくしが――,这次我让他好好认可了！<BR>我要——,,<r\=きっちり認めさせてきましたわ！　>这次我让他好好认可了！<BR>我要——</r>\r\n
adv_dear_kcna_009.txt,173,2,1,千奈,これからも先生と一緒に、\nアイドルを続けることを！,今后也要继续和老师一起<BR>当偶像这件事！,,<r\=これからも先生と一緒に、>今后也要继续和老师一起<BR>当偶像这件事！</r>\r\n
adv_dear_kcna_009.txt,180,2,1,千奈,はいっ！　プロデューサーは、\nこれからもずぅ～～～～～～～っと！,是！制作人先生<BR>从今以后也要一直～～～～～～～！,,<r\=はいっ！　プロデューサーは、>是！制作人先生<BR>从今以后也要一直～～～～～～～！</r>\r\n
adv_dear_kcna_009.txt,191,2,1,千奈,もちろんですわっ！　だってわたくし、\nまだまだまだまだ未熟ですものっ！,当然记得呀！,,<r\=もちろんですわっ！>当然记得呀！</r>　だってわたくし、\nまだまだまだまだ未熟ですものっ！
adv_dear_kcna_009.txt,196,2,1,千奈,ご存じのとおり、ステージに立てる\nギリギリの実力しかありませんものっ！,您知道的，我只有<BR>勉强能站上舞台的实力而已！,,<r\=ご存じのとおり、ステージに立てる>您知道的，我只有<BR>勉强能站上舞台的实力而已！</r>\r\n
adv_dear_kcna_009.txt,201,2,1,{user},自信満々に情けない台詞を言うのは、\n今後控えましょうね。,以后请别再用这么自信的语气<BR>说出丧气话了。,,<r\=自信満々に情けない台詞を言うのは、>以后请别再用这么自信的语气<BR>说出丧气话了。</r>\r\n
adv_dear_kcna_009.txt,202,2,1,{user},あなたはもう、\n立派なアイドルなのですから。,因为你已经是<BR>独当一面的偶像了。,,<r\=あなたはもう、>因为你已经是<BR>独当一面的偶像了。</r>\r\n
adv_dear_kcna_009.txt,211,2,1,千奈,わたくし、もう自分を劣等生の\n最底辺アイドルだなんて呼びませんわ。,我再也不会自称是<BR>差生中最底层的偶像了。,,<r\=わたくし、もう自分を劣等生の>我再也不会自称是<BR>差生中最底层的偶像了。</r>\r\n
adv_dear_kcna_009.txt,214,2,1,千奈,わたくしを応援してくださる\nファンの皆様に失礼ですもの。,这样对支持我的<BR>粉丝们太失礼了。,,<r\=わたくしを応援してくださる>这样对支持我的<BR>粉丝们太失礼了。</r>\r\n
adv_dear_kcna_009.txt,220,2,1,千奈,そう、今日からのわたくしは、\nとっても立派なっ！,没错，从今天开始<BR>我要成为非常优秀的！,,<r\=そう、今日からのわたくしは、>没错，从今天开始<BR>我要成为非常优秀的！</r>\r\n
adv_dear_kcna_009.txt,231,2,1,{user},立派なアイドルに育ってくれた。\nここからが本当のスタートだ。,你已经成长为出色的偶像了。<BR>现在才是真正的起点。,,<r\=立派なアイドルに育ってくれた。>你已经成长为出色的偶像了。<BR>现在才是真正的起点。</r>\r\n
adv_dear_kcna_011.txt,294,2,1,千奈,はいっ！　先生は、\nこうおっしゃいました。,好的！老师刚才说...,,<r\=はいっ！　先生は、>好的！老师刚才说...</r>\r\n
adv_dear_kcna_011.txt,302,2,1,千奈,『N.I.A』は、我々にとって\n有利な大会だと……何故なのでしょう？,,,<r\=『N.I.A』は、我々にとって></r>\r\n
adv_dear_kcna_016.txt,138,2,1,千奈,わたくし、\nまたなにかやってしまいました？,我又...做了什么吗？,,<r\=わたくし、>我又...做了什么吗？</r>\r\n
adv_dear_kcna_018.txt,61,2,1,{user},倉本さん。話の腰を折って\n申し訳ありませんが。,仓本小姐。很抱歉打断你。,,<r\=倉本さん。話の腰を折って>仓本小姐。很抱歉打断你。</r>\r\n
adv_dear_kcna_019.txt,167,2,1,千奈,はいっ！　はいっ！　\nまさしくその通りですわ！,没错！完全正确！,,<r\=はいっ！　はいっ！　>没错！完全正确！</r>\r\n
adv_dear_kllj_001.txt,99,2,1,リーリヤ,父が日本人なんです。\n,因为父亲是日本人。,,<r\=父が日本人なんです。>因为父亲是日本人。</r>\r\n
adv_dear_kllj_003.txt,37,2,1,{user},……うーん、そうですね、\n今お伝えするか悩ましい所ですが――,……嗯——让我犹豫要不要现在说呢——,,<r\=……うーん、そうですね、>……嗯——让我犹豫要不要现在说呢——</r>\r\n
adv_dear_kllj_003.txt,135,2,1,{user},……もう少し自然な感じに\nなりませんか？,……能不能更自然一点呢？,,<r\=……もう少し自然な感じに>……能不能更自然一点呢？</r>\r\n
adv_dear_kllj_003.txt,165,2,1,リーリヤ,い、いえ、なんか方向性が違うと\n思うんですけど……。,不、不是，总觉得方向性不太对……,,<r\=い、いえ、なんか方向性が違うと>不、不是，总觉得方向性不太对……</r>\r\n
adv_dear_kllj_003.txt,213,2,1,リーリヤ,……！\n分かりました……！,……！,,<r\=……！>……！</r>\n分かりました……！
adv_dear_kllj_004.txt,112,2,1,{user},失礼。盗み聞きをするつもりは\nなかったのですが――,失礼了。虽然没打算偷听——,,<r\=失礼。盗み聞きをするつもりは>失礼了。虽然没打算偷听——</r>\r\n
adv_dear_kllj_005.txt,164,2,1,アイドル科の生徒C,今日は見て学ぶレッスンなんだって。\n,听说今天是观摩学习课哦。,,<r\=今日は見て学ぶレッスンなんだって。>听说今天是观摩学习课哦。</r>\r\n
adv_dear_kllj_007.txt,416,2,1,清夏,…………約束、何のことだっけ？\nあたし、すぐ忘れちゃうんだよね～。,…………,,<r\=…………>…………</r>約束、何のことだっけ？\nあたし、すぐ忘れちゃうんだよね～。
adv_dear_kllj_008.txt,148,2,1,{user},……葛城さん。\n今日はもう帰りましょう。,......葛城同学。,,<r\=……葛城さん。>......葛城同学。</r>\n今日はもう帰りましょう。
adv_dear_kllj_010-01.txt,40,2,1,{user},やれと言われないとやらない人は\nよくいますが――,虽然有很多人不说就不做——,,<r\=やれと言われないとやらない人は>虽然有很多人不说就不做——</r>\r\n
adv_dear_kllj_010.txt,95,3,2,清夏,あっ、やっと見つけた！\n探したよ～。\n,啊，终于找到啦！\n找你好久了～,,<r\=あっ、やっと見つけた！>啊，终于找到啦！</r>\r\n<r\=探したよ～。>找你好久了～</r>\r\n
adv_dear_kllj_010.txt,100,3,2,清夏,昨日は部屋帰ったら寝ちゃってたし、\n起きたらもう出かけてるし。\n,昨天回房间就睡着了\n醒来发现你已经出门了～,,<r\=昨日は部屋帰ったら寝ちゃってたし、>昨天回房间就睡着了</r>\r\n<r\=起きたらもう出かけてるし。>醒来发现你已经出门了～</r>\r\n
adv_dear_kllj_010.txt,106,3,2,リーリヤ,ご、ごめんね。帰ったら\n気が抜けちゃって、すぐ……。\n,对、对不起。回来后\n整个人放松下来就...,,<r\=ご、ごめんね。帰ったら>对、对不起。回来后</r>\r\n<r\=気が抜けちゃって、すぐ……。>整个人放松下来就...</r>\r\n
adv_dear_kllj_010.txt,116,3,2,清夏,ううん──\nライブ、めっちゃ良かったよ！\n,没事啦──\n昨天的演唱会超级棒！,,<r\=ううん──>没事啦──</r>\r\n<r\=ライブ、めっちゃ良かったよ！>昨天的演唱会超级棒！</r>\r\n
adv_dear_kllj_013.txt,81,2,1,リーリヤ,仕方ない……って。\nみんな、わたしよりすごい人だから。,没办法......毕竟大家都比我厉害。,,<r\=仕方ない……って。>没办法......毕竟大家都比我厉害。</r>\r\n
adv_dear_kllj_013.txt,96,2,1,リーリヤ,……センパイ。\nわたしは、勝ちます。,......前辈。,,<r\=……センパイ。>......前辈。</r>\nわたしは、勝ちます。
adv_dear_kllj_014.txt,328,2,1,{user},一生懸命に頑張れるところは、\n葛城さんの魅力です。,全力以赴是你的魅力所在。,,<r\=一生懸命に頑張れるところは、>全力以赴是你的魅力所在。</r>\r\n
adv_dear_kllj_015.txt,156,2,1,リーリヤ,はい……！\n今のわたしの、精一杯を……！,是……！,,<r\=はい……！>是……！</r>\n今のわたしの、精一杯を……！
adv_dear_kllj_017.txt,115,2,1,リーリヤ,叶うと思っているわけじゃ、\nありません……。,并不是说一定能实现......,,<r\=叶うと思っているわけじゃ、>并不是说一定能实现......</r>\r\n
adv_dear_kllj_020.txt,59,2,1,リーリヤ,始まる前、緊張して、不安で……\nお腹が痛かったんですけど……,开始前明明紧张得...肚子都疼了...,,<r\=始まる前、緊張して、不安で……>开始前明明紧张得...肚子都疼了...</r>\r\n
adv_dear_kllj_020.txt,89,2,1,リーリヤ,そう思って……それからは、\nとにかく必死でした。,这么想着...之后就只顾拼命了。,,<r\=そう思って……それからは、>这么想着...之后就只顾拼命了。</r>\r\n
adv_dear_shro_001.txt,317,3,2,{user},流れでプロデュースすることに\nなったが……\n,顺势答应了负责育成工作……\n,,<r\=流れでプロデュースすることに>顺势答应了负责育成工作……</r>\r\n<r\=なったが……></r>\r\n
adv_dear_shro_003.txt,314,2,1,広,片足立ちを10秒維持できるように\nならないといけない。,要做到能单脚站立维持十秒钟。,,<r\=片足立ちを10秒維持できるように>要做到能单脚站立维持十秒钟。</r>\r\n
adv_dear_shro_005.txt,26,2,1,広,アイドルを<em>目指すため</em>に入った\nって答えたら……,"我回答说""是为了成为偶像""之后...",,"<r\=アイドルを目指すために入った>我回答说""是为了成为偶像""之后...</r>\r\n"
adv_dear_shro_005.txt,115,2,1,{user},ですから……思ったことを、\nそのまま言うことにします。,所以...我就直说我的想法了。,,<r\=ですから……思ったことを、>所以...我就直说我的想法了。</r>\r\n
adv_dear_shro_005.txt,160,2,1,{user},趣味は夢に劣るものではないと\n思います。,我认为爱好并不比梦想低劣。,,<r\=趣味は夢に劣るものではないと>我认为爱好并不比梦想低劣。</r>\r\n
adv_dear_shro_005.txt,172,2,1,{user},テンションが上がっているように\nさえ見えます。,你反而显得更亢奋了。,,<r\=テンションが上がっているように>你反而显得更亢奋了。</r>\r\n
adv_dear_shro_006.txt,410,2,1,佑芽,ち、千奈ちゃんに足のマッサージは\nしたことないじゃない。,又、又没给千奈酱按过脚！,,<r\=ち、千奈ちゃんに足のマッサージは>又、又没给千奈酱按过脚！</r>\r\n
adv_dear_shro_006.txt,511,2,1,佑芽,ほっ……効果があったなら、\nよかったよ～。,呼...有效果就好~,,<r\=ほっ……効果があったなら、>呼...有效果就好~</r>\r\n
adv_dear_shro_007.txt,61,2,1,{user},最近、篠澤さんを\nプロデュースする夢を見るんです。,最近我老是梦到在培育篠泽小姐。,,<r\=最近、篠澤さんを>最近我老是梦到在培育篠泽小姐。</r>\r\n
adv_dear_shro_008.txt,230,2,1,広,プロデューサー。\nわたし、あのとき言ったよ。,制作人。,,<r\=プロデューサー。>制作人。</r>\nわたし、あのとき言ったよ。
adv_dear_shro_011.txt,37,2,1,{user},有力な新人アイドルとして\n名を馳せてもらうつもりです。,成为备受瞩目的强力新人偶像。,,<r\=有力な新人アイドルとして>成为备受瞩目的强力新人偶像。</r>\r\n
adv_dear_shro_011.txt,43,2,1,広,ようやくライブができるように\nなったけど。,虽然终于能登台演出了。,,<r\=ようやくライブができるように>虽然终于能登台演出了。</r>\r\n
adv_dear_shro_012.txt,106,2,1,{user},あまりにも無軌道に\n拡散されていくので、,由于传播速度过于失控，,,<r\=あまりにも無軌道に>由于传播速度过于失控，</r>\r\n
adv_dear_shro_012.txt,129,2,1,広,わたしを女神って呼ぶの、\nなんとかできない？,能不能别让他们叫我女神了？,,<r\=わたしを女神って呼ぶの、>能不能别让他们叫我女神了？</r>\r\n
adv_dear_shro_013.txt,259,2,1,千奈,篠澤さんのライバルに\nしてくださいませっ！,篠泽同学的竞争对手吧！,,<r\=篠澤さんのライバルに>篠泽同学的竞争对手吧！</r>\r\n
adv_dear_shro_017.txt,263,2,1,佑芽,『N.I.A』ランキング1桁！\n到達おめでと～～～っ！,恭喜你登上『N.I.A』排行榜前十名~~！,,<r\=『N.I.A』ランキング1桁！>恭喜你登上『N.I.A』排行榜前十名~~！</r>\r\n
adv_dear_shro_018.txt,61,2,1,{user},決戦の前に、テンションを\n下げたくないのですが……,决战前不想说泄气话...,,<r\=決戦の前に、テンションを>决战前不想说泄气话...</r>\r\n
adv_dear_shro_018.txt,64,2,1,{user},あなたを……思いっ切り\n褒めてもいいでしょうか？,可以让我...好好夸奖你吗？,,<r\=あなたを……思いっ切り>可以让我...好好夸奖你吗？</r>\r\n
adv_dear_shro_020.txt,157,2,1,{user},どう考えているのか、と、\n問われたんです。,他问我究竟是怎么想的。,,<r\=どう考えているのか、と、>他问我究竟是怎么想的。</r>\r\n
adv_dear_ssmk_001.txt,109,2,1,清夏,あそこで頑張って走ってる女の子、\n見えるよね？,看到那边拼命跑步的女孩子了吗？,,<r\=あそこで頑張って走ってる女の子、>看到那边拼命跑步的女孩子了吗？</r>\r\n
adv_dear_ssmk_004.txt,160,2,1,清夏,それはフツーに、アイドル見るのが\n好きなだけだし～。,那只是单纯喜欢看偶像表演啦～。,,<r\=それはフツーに、アイドル見るのが>那只是单纯喜欢看偶像表演啦～。</r>\r\n
adv_dear_ssmk_005.txt,82,2,1,{user},……右ひざに大きな怪我を負ったと、\nそう聞きました。,……听说您右膝受过重伤。,,<r\=……右ひざに大きな怪我を負ったと、>……听说您右膝受过重伤。</r>\r\n
adv_dear_ssmk_007.txt,245,2,1,清夏,……そりゃー、だってさー、\nしんどいに決まってるじゃん！,……,,<r\=……>……</r>そりゃー、だってさー、\nしんどいに決まってるじゃん！
adv_dear_ssmk_007.txt,261,2,1,{user},……いや、違うな。そうじゃない。\n清夏さん。俺は、支えたいんです。,……,,<r\=……>……</r>いや、違うな。そうじゃない。\n清夏さん。俺は、支えたいんです。
adv_dear_ssmk_009.txt,205,2,1,リーリヤ,……あの約束に支えられているのは、\nわたしも同じです。,……那个约定也同样支撑着我。,,<r\=……あの約束に支えられているのは、>……那个约定也同样支撑着我。</r>\r\n
adv_dear_ssmk_009.txt,217,2,1,{user},……いつか来るその日のことを、\n楽しみにしています。,……我期待着那一天的到来。,,<r\=……いつか来るその日のことを、>……我期待着那一天的到来。</r>\r\n
adv_dear_ssmk_010-01.txt,49,2,1,{user},些細なことでも、何かあれば\nちゃんと報告してください。,再小的事也要及时汇报。,,<r\=些細なことでも、何かあれば>再小的事也要及时汇报。</r>\r\n
adv_dear_ssmk_011.txt,133,2,1,{user},今回ばかりは本当に、\n大したことをしていません。,这次真的没做什么大不了的事。,,<r\=今回ばかりは本当に、>这次真的没做什么大不了的事。</r>\r\n
adv_dear_ssmk_011.txt,186,2,1,{user},注目されているのは、\n良いことばかりではありません。,被人关注并不全是好事。,,<r\=注目されているのは、>被人关注并不全是好事。</r>\r\n
adv_dear_ssmk_014.txt,237,2,1,清夏,（Pっちがこんなに怒ってるトコ、\n　初めて見た……）,（第一次看到P这么生气的样子……）,,<r\=（Pっちがこんなに怒ってるトコ、>（第一次看到P这么生气的样子……）</r>\r\n
adv_dear_ssmk_014.txt,329,2,1,清夏,リーリヤには……弱いところを、\n見せたくなくて。,不想让莉莉娅……看到我软弱的样子。,,<r\=リーリヤには……弱いところを、>不想让莉莉娅……看到我软弱的样子。</r>\r\n
adv_dear_ssmk_014.txt,373,2,1,清夏,あたしは、リーリヤが思ってるほど、\n大したやつじゃないんだよ！,我根本不是莉莉娅想的那么厉害的人！,,<r\=あたしは、リーリヤが思ってるほど、>我根本不是莉莉娅想的那么厉害的人！</r>\r\n
adv_dear_ssmk_014.txt,393,2,1,清夏,リーリヤはさ、ずっとあたしを\n信じてくれてるよね。,莉莉娅你啊，一直都很信任我对吧。,,<r\=リーリヤはさ、ずっとあたしを>莉莉娅你啊，一直都很信任我对吧。</r>\r\n
adv_dear_ssmk_017.txt,72,2,1,清夏,……え？\nあの子、そんなにすごいの？,……诶？,,<r\=……え？>……诶？</r>\nあの子、そんなにすごいの？
adv_dear_ssmk_018.txt,80,2,1,四音,私の見立ては間違っていなかった、\nということですね。,这说明我的判断没有错呢。,,<r\=私の見立ては間違っていなかった、>这说明我的判断没有错呢。</r>\r\n
adv_dear_ssmk_019.txt,105,2,1,{user},清夏さんが、極月学園の誘いを\n断ってくれたことです。,你拒绝了极月学园的邀请这件事。,,<r\=清夏さんが、極月学園の誘いを>你拒绝了极月学园的邀请这件事。</r>\r\n
adv_dear_ttmr_001.txt,79,2,1,手毬,私が起こした<em>問題</em>を……\n知っていると？,你是说……你知道我引发的问题？,,<r\=私が起こした問題を……>你是说……你知道我引发的问题？</r>\r\n
adv_dear_ttmr_001.txt,119,2,1,手毬,（……そんなに怒ってる\nみたいに見えるのかな……？）,（...我看起来有那么生气吗...？）,,<r\=（……そんなに怒ってる>（...我看起来有那么生气吗...？）</r>\r\n
adv_dear_ttmr_001.txt,138,2,1,手毬,（制度の恩恵を受けられるだけでも、\n十分なメリットだし……それに）,（光是能享受制度福利就已经很有价值了...况且）,,<r\=（制度の恩恵を受けられるだけでも、>（光是能享受制度福利就已经很有价值了...况且）</r>\r\n
adv_dear_ttmr_002.txt,25,2,1,手毬,私のプロデュースをさせてあげるって\n言ったけど……,虽然说是让你来培育我...,,<r\=私のプロデュースをさせてあげるって>虽然说是让你来培育我...</r>\r\n
adv_dear_ttmr_002.txt,47,2,1,{user},専門家の意見を\n聞きたくはありませんか？,想听听专家的意见吗？,,<r\=専門家の意見を>想听听专家的意见吗？</r>\r\n
adv_dear_ttmr_002.txt,95,2,1,{user},そうなってしまう理由を……\n……聞きたいですか？,想知道为什么会变成这样吗......？,,<r\=そうなってしまう理由を……>想知道为什么会变成这样吗......？</r>\r\n
adv_dear_ttmr_002.txt,240,2,1,{user},不調の原因は伝えられた。あの食事、\n気に入ってくれるといいんだが……,已经告知她状态不佳的原因。希望她能喜欢那些特制餐食...,,<r\=不調の原因は伝えられた。あの食事、>已经告知她状态不佳的原因。希望她能喜欢那些特制餐食...</r>\r\n
adv_dear_ttmr_004.txt,146,2,1,{user},だからどんなアクシデントにも\n即応できた。,所以才能应对任何突发状况啊。,,<r\=だからどんなアクシデントにも>所以才能应对任何突发状况啊。</r>\r\n
adv_dear_ttmr_004.txt,176,2,1,手毬,ユニットから\n抜けるしかなかったんです！,只能选择退出组合了！,,<r\=ユニットから>只能选择退出组合了！</r>\r\n
adv_dear_ttmr_005.txt,50,2,1,{user},ぎりぎりまでパフォーマンスが\n落ちないようにしましょう。,让表演水准不至于下滑太多。,,<r\=ぎりぎりまでパフォーマンスが>让表演水准不至于下滑太多。</r>\r\n
adv_dear_ttmr_005.txt,87,2,1,{user},カメラに慣れていない\nはずはないでしょう。,你早就应该习惯镜头了吧？,,<r\=カメラに慣れていない>你早就应该习惯镜头了吧？</r>\r\n
adv_dear_ttmr_006.txt,187,2,1,{user},月村さん。本当に素晴らしい\nライブでした……が。,月村小姐。演出确实非常精彩......但是。,,<r\=月村さん。本当に素晴らしい>月村小姐。演出确实非常精彩......但是。</r>\r\n
adv_dear_ttmr_006.txt,189,2,1,{user},7割の力でいきましょう、と、\n言いましたよね？,我说过只用七成力气的吧？,,<r\=7割の力でいきましょう、と、>我说过只用七成力气的吧？</r>\r\n
