filename,line_number,orig_segments,trans_segments,name,orig_text,trans_text,trans_fixed,trans_orig
adv_csprt-3-0009_01.txt,59,2,1,手毬,補習の補習なんてあるんだ。\nはじめて聞いた。,补课的补课还是第一次听说。,,<r\=補習の補習なんてあるんだ。>补课的补课还是第一次听说。</r>\r\n
adv_csprt-3-0009_02.txt,126,2,1,佑芽,う～ん、やっぱり広ちゃんの部屋\nって感じ！,唔~果然超有小广的房间特色！,,<r\=う～ん、やっぱり広ちゃんの部屋>唔~果然超有小广的房间特色！</r>\r\n
adv_csprt-3-0011_03.txt,103,2,1,佑芽,すごーく成績の悪いあたしに\n声をかけてくれたんですか？,主动邀请成绩这么差劲的我呢？,,<r\=すごーく成績の悪いあたしに>主动邀请成绩这么差劲的我呢？</r>\r\n
adv_csprt-3-0012_03.txt,48,2,1,一同,（一緒にレッスンを\nすることになるなんて――）,（一起上课什么的——）,,<r\=（一緒にレッスンを>（一起上课什么的——）</r>\r\n
adv_csprt-3-0013_03.txt,100,2,1,ことね,いや……もらえませんよ。\n理由もなく。,不要...无缘无故的票我不能收。,,<r\=いや……もらえませんよ。>不要...无缘无故的票我不能收。</r>\r\n
adv_csprt-3-0014_02.txt,36,2,1,星南,相手の動きを自然に\n誘導するテクニックよ。,这是自然引导对方行动的技巧哦。,,<r\=相手の動きを自然に>这是自然引导对方行动的技巧哦。</r>\r\n
adv_csprt-3-0016_01.txt,20,2,1,千奈,全員、ひとりたりとも\n欠けることなく――,全班同学一个都不能少——,,<r\=全員、ひとりたりとも>全班同学一个都不能少——</r>\r\n
adv_csprt-3-0016_01.txt,54,2,1,広,あっち、歩いて\n遠ざかっていく人影が。,那边...有个渐渐走远的背影呢。,,<r\=あっち、歩いて>那边...有个渐渐走远的背影呢。</r>\r\n
adv_csprt-3-0019_03.txt,31,2,1,{user},したがって先生をアイドルとして\nプロデュースするならば……,因此如果要培育老师成为偶像的话...,,<r\=したがって先生をアイドルとして>因此如果要培育老师成为偶像的话...</r>\r\n
adv_csprt-3-0020_01.txt,34,2,1,{user},友達と呼べるかどうかは\nわかりませんが。,虽然不确定能不能算朋友,,<r\=友達と呼べるかどうかは>虽然不确定能不能算朋友</r>\r\n
adv_csprt-3-0020_03.txt,30,2,1,あさり先生,料理のできない人だと\n勘違いしているようですからね。,不会做饭的人呢。,,<r\=料理のできない人だと>不会做饭的人呢。</r>\r\n
adv_csprt-3-0021_01.txt,48,2,1,手毬,（小降りになるまで\n雨宿りして――……）,（等雨小点再走吧——……）,,<r\=（小降りになるまで>（等雨小点再走吧——……）</r>\r\n
adv_csprt-3-0021_02.txt,126,2,1,美鈴,なら、よかった。雷、すごく大きな\n音が鳴っていたから……怖くて。,那就好。刚才雷声特别大......我有点害怕。,,<r\=なら、よかった。雷、すごく大きな>那就好。刚才雷声特别大......我有点害怕。</r>\r\n
adv_csprt-3-0022_02.txt,30,2,1,麻央,（どんな時でも、スマートかつ\n　優雅な王子様であるために……ん？）,（无论何时都要保持优雅王子风范...咦？）,,<r\=（どんな時でも、スマートかつ>（无论何时都要保持优雅王子风范...咦？）</r>\r\n
adv_csprt-3-0022_02.txt,106,2,1,麻央,濡れ鼠のまま職場に行くわけには、\nいかないだろう？,总不能浑身湿透地去工作吧？,,<r\=濡れ鼠のまま職場に行くわけには、>总不能浑身湿透地去工作吧？</r>\r\n
adv_csprt-3-0022_03.txt,97,2,1,麻央,キミが頑張っているのは\nよくわかるけど、,我知道你很努力，,,<r\=キミが頑張っているのは>我知道你很努力，</r>\r\n
adv_csprt-3-0023_01.txt,70,2,1,咲季,なかなかするような機会は\nないものね。,确实没什么机会呢。,,<r\=なかなかするような機会は>确实没什么机会呢。</r>\r\n
adv_csprt-3-0023_02.txt,92,2,1,咲季,ふふ～、お父さんに学園のトレーニング\n設備の自慢をしたら、,呵呵～我跟爸爸炫耀学校的训练设备后，,,<r\=ふふ～、お父さんに学園のトレーニング>呵呵～我跟爸爸炫耀学校的训练设备后，</r>\r\n
adv_csprt-3-0023_02.txt,104,2,1,佑芽,また親子でめんどくさそ～な\nことしてる～！,你们父女又在搞麻烦事～！,,<r\=また親子でめんどくさそ～な>你们父女又在搞麻烦事～！</r>\r\n
adv_csprt-3-0025_01.txt,131,2,1,広,入り口に『こどもハイキング』\nって書いてあった。,入口写着『儿童远足路线』。,,<r\=入り口に『こどもハイキング』>入口写着『儿童远足路线』。</r>\r\n
adv_csprt-3-0028_02.txt,141,2,1,美鈴,まりちゃんと話してる\nって感じがします。,体会到和小毬说话的感觉了。,,<r\=まりちゃんと話してる>体会到和小毬说话的感觉了。</r>\r\n
adv_csprt-3-0034_01.txt,47,2,1,莉波,見て見て！　新しい秋物の\nルームウェア買っちゃった。,快看快看！我买了新的秋季家居服哦。,,<r\=見て見て！　新しい秋物の>快看快看！我买了新的秋季家居服哦。</r>\r\n
adv_csprt-3-0034_01.txt,90,2,1,莉波,私はアロマキャンドルを\nたまに使ってるよ。,我偶尔会用香薰蜡烛哦。,,<r\=私はアロマキャンドルを>我偶尔会用香薰蜡烛哦。</r>\r\n
adv_csprt-3-0034_01.txt,104,2,1,莉波,本当？\nきっとその香りだね。,真的？肯定是那个香味吧。,,<r\=本当？>真的？肯定是那个香味吧。</r>\r\n
adv_csprt-3-0034_01.txt,140,2,1,莉波,麻央のそういう面倒見のいいところ\n私、好きだなぁ。,我最喜欢麻央这种会照顾人的地方了。,,<r\=麻央のそういう面倒見のいいところ>我最喜欢麻央这种会照顾人的地方了。</r>\r\n
adv_csprt-3-0037_02.txt,155,2,1,千奈,楽しそうにしている場合じゃ\nありませんわ～～～！,现在不是开心的时候啦～～～！,,<r\=楽しそうにしている場合じゃ>现在不是开心的时候啦～～～！</r>\r\n
adv_csprt-3-0039_02.txt,95,2,1,ことね,はぁ、はぁ、はぁ……！\nあと、ちょっと……！,哈、哈、哈……,,<r\=はぁ、はぁ、はぁ……>哈、哈、哈……</r>！\nあと、ちょっと……！
adv_csprt-3-0039_03.txt,31,2,1,星南,正直、私のペースについてこられるとは\n思わなかったわ。,说实话，没想到你能跟上我的节奏。,,<r\=正直、私のペースについてこられるとは>说实话，没想到你能跟上我的节奏。</r>\r\n
adv_csprt-3-0040_03.txt,56,2,1,リーリヤ,……なんだか、もったいないなって\n思ってしまって……。,……总觉得，这样好浪费啊……,,<r\=……なんだか、もったいないなって>……总觉得，这样好浪费啊……</r>\r\n
adv_csprt-3-0041_01.txt,6,2,1,星南,駅前で、イルミネーションの展示が\n始まっているようね。,车站前好像开始展出彩灯了呢。,,<r\=駅前で、イルミネーションの展示が>车站前好像开始展出彩灯了呢。</r>\r\n
adv_csprt-3-0045_01.txt,67,2,1,広,わかる。わたしも絶望的に歌えなくて\nわくわくしてる。,我懂。我唱歌烂到绝望反而很兴奋。,,<r\=わかる。わたしも絶望的に歌えなくて>我懂。我唱歌烂到绝望反而很兴奋。</r>\r\n
adv_csprt-3-0045_02.txt,143,2,1,佑芽,あたしも、人に教えられるくらい\n上手に歌えるようになるぞ～～～っ！,我也要练到能指导别人的程度～～～！,,<r\=あたしも、人に教えられるくらい>我也要练到能指导别人的程度～～～！</r>\r\n
adv_csprt-3-0046_01.txt,41,2,1,燕,指導？　貴様らも3年間、\n練習し続けたのだろう。,指导？你们好歹也持续练习了三年，,,<r\=指導？　貴様らも3年間、>指导？你们好歹也持续练习了三年，</r>\r\n
adv_csprt-3-0046_02.txt,61,2,1,燕,この曲は初星学園そのものだと\n言っていい。,可以说这首曲子就是初星学园本身的化身。,,<r\=この曲は初星学園そのものだと>可以说这首曲子就是初星学园本身的化身。</r>\r\n
adv_csprt-3-0046_02.txt,65,2,1,燕,その代の生徒の出来を\n披露することに等しい。,就等于在展示那一届学生的实力。,,<r\=その代の生徒の出来を>就等于在展示那一届学生的实力。</r>\r\n
adv_csprt-3-0046_02.txt,98,2,1,燕,……まあ、貴様は楽にしていても\n構わんぞ。,......不过，你这家伙轻松点也没关系哦。,,<r\=……まあ、貴様は楽にしていても>......不过，你这家伙轻松点也没关系哦。</r>\r\n
adv_csprt-3-0046_03.txt,123,2,1,麻央,そう……ボクたちは、\n先輩からバトンをもらったんだ。,是啊……我们<br]从前辈那里接过了接力棒。,,<r\=そう……ボクたちは、>是啊……我们<br]从前辈那里接过了接力棒。</r>\r\n
adv_csprt-3-0050_01.txt,19,2,1,千奈,わたくしたちがお友達になった\nばかりの頃も、この公園で……,那时候我们还经常绕路来玩呢~真令人怀念~,,<r\=わたくしたちがお友達になった>那时候我们还经常绕路来玩呢~真令人怀念~</r>\r\n
adv_csprt-3-0050_02.txt,149,2,1,千奈,お互い様ですわ。もしも篠澤さんが\nいらっしゃらなかったら……,彼此彼此。如果没有筱泽小姐的话...,,<r\=お互い様ですわ。もしも篠澤さんが>彼此彼此。如果没有筱泽小姐的话...</r>\r\n
adv_csprt-3-0053_02.txt,107,2,1,星南,お仕事、すごく頑張っていたから、\n30個ほど購入しようとしたのだけど。,本来想买30个支持她的...,,<r\=お仕事、すごく頑張っていたから、>本来想买30个支持她的...</r>\r\n
adv_csprt-3-0054_03.txt,100,2,1,咲季,……これからは<r\=レジェンド>伝説の</r>マンモスさん\nって呼んだ方がいい？,……以后该称呼你传说猛犸象小姐吗？,,<r\=……これからは伝説のマンモスさん>……以后该称呼你传说猛犸象小姐吗？</r>\r\n
adv_csprt-3-0054_03.txt,131,2,1,咲季,リーリヤは、自分の腕前をあまり\nひけらかしたくないタイプだったのね。,原来莉莉娅是不喜欢炫耀自己实力的类型啊。,,<r\=リーリヤは、自分の腕前をあまり>原来莉莉娅是不喜欢炫耀自己实力的类型啊。</r>\r\n
adv_csprt-3-0054_03.txt,135,2,1,リーリヤ,というより……咲季ちゃんが\n外でわたしをそう呼んで……,倒不如说……要是在外面被你这么叫……,,<r\=というより……咲季ちゃんが>倒不如说……要是在外面被你这么叫……</r>\r\n
adv_dear_amao_001.txt,141,2,1,麻央,キミは小柄で可憐な外見なんだから、\nそんな少年みたいな格好はやめて、,,,<r\=キミは小柄で可憐な外見なんだから、></r>\r\n
adv_dear_amao_001.txt,151,2,1,麻央,ボクは可愛いアイドルになんて、\nなりたくない。,我才不要当什么可爱偶像。,,<r\=ボクは可愛いアイドルになんて、>我才不要当什么可爱偶像。</r>\r\n
adv_dear_amao_001.txt,154,2,1,麻央,子供の頃から憧れてきたのは、\n歌劇団のスターみたいな、,从小时候起我就一直向往的，是像歌剧团的明星那样，,,<r\=子供の頃から憧れてきたのは、>从小时候起我就一直向往的，是像歌剧团的明星那样，</r>\r\n
adv_dear_amao_002.txt,207,2,1,莉波,麻央には、\n本当にいつも助けてもらってて、,真的经常受到麻央帮助，,,<r\=麻央には、>真的经常受到麻央帮助，</r>\r\n
adv_dear_amao_002.txt,267,2,1,麻央,ちょっと見せて……\nむ……足を捻ったのか。,让我看看...嗯...脚扭伤了呢。,,<r\=ちょっと見せて……>让我看看...嗯...脚扭伤了呢。</r>\r\n
adv_dear_amao_003.txt,43,2,1,麻央,かっこいい王子様になるって、\n決めたんです。,成为帅气的王子。,,<r\=かっこいい王子様になるって、>成为帅气的王子。</r>\r\n
adv_dear_amao_003.txt,208,2,1,麻央,……っ！？\nなっ――――――,……！？,,<r\=……っ！？>……！？</r>\nなっ――――――
adv_dear_amao_004.txt,134,2,1,{user},学園のトップアイドルたちのことを、\n思い出してください。,请回想一下学院里的顶级偶像们。,,<r\=学園のトップアイドルたちのことを、>请回想一下学院里的顶级偶像们。</r>\r\n
adv_dear_amao_004.txt,136,2,1,{user},それだけでトップに立っている人は、\nひとりもいないはずです。,是不可能站上顶峰的。,,<r\=それだけでトップに立っている人は、>是不可能站上顶峰的。</r>\r\n
adv_dear_amao_004.txt,175,2,1,麻央,……わかりました。\nなってみせますよ。,……我明白了。,,<r\=……わかりました。>……我明白了。</r>\nなってみせますよ。
adv_dear_amao_007.txt,62,2,1,麻央,ありがとうございます。\nプロデューサーのおかげです。,都是托制作人的福。,,<r\=ありがとうございます。>都是托制作人的福。</r>\r\n
adv_dear_amao_007.txt,135,2,1,麻央,本当は、お砂糖もミルクも、\nたっぷり入れたいし、,其实我更喜欢多加糖和奶，,,<r\=本当は、お砂糖もミルクも、>其实我更喜欢多加糖和奶，</r>\r\n
adv_dear_amao_012.txt,144,2,1,{user},SNSや動画での拡散も、\nこちら側が発信するよりも、,在SNS和视频平台的传播方面，,,<r\=SNSや動画での拡散も、>在SNS和视频平台的传播方面，</r>\r\n
adv_dear_amao_012.txt,332,2,1,麻央,キミはまだ1年生なんだから、\n無理はせずに――,你才一年级，不要太勉强——,,<r\=キミはまだ1年生なんだから、>你才一年级，不要太勉强——</r>\r\n
adv_dear_amao_012.txt,550,2,1,麻央,今日はたしか、アルバイトの日\nじゃなかった？,今天不是有打工吗？,,<r\=今日はたしか、アルバイトの日>今天不是有打工吗？</r>\r\n
adv_dear_amao_013.txt,109,2,1,麻央,いえ、厳しくしてくれて、\nありがとうございます。,不，谢谢你对我这么严格。,,<r\=いえ、厳しくしてくれて、>不，谢谢你对我这么严格。</r>\r\n
adv_dear_amao_014.txt,60,2,1,麻央,そういえば、\nボクをスカウトしたときも、,说起来当初招募我的时候，,,<r\=そういえば、>说起来当初招募我的时候，</r>\r\n
adv_dear_amao_014.txt,69,2,1,麻央,これまで、ボクをプロデュース\nしようとした人の中に、,之前那些说要培养我的人里，,,<r\=これまで、ボクをプロデュース>之前那些说要培养我的人里，</r>\r\n
adv_dear_amao_014.txt,329,2,1,四音,この私が、完膚なきまでに\n粉砕して差し上げますよ。,由我来彻底粉碎给你看吧。,,<r\=この私が、完膚なきまでに>由我来彻底粉碎给你看吧。</r>\r\n
adv_dear_amao_018.txt,147,2,1,月花,会場のファンを楽しませることを、\n完全に忘れていた。,让现场观众感到快乐。,,<r\=会場のファンを楽しませることを、>让现场观众感到快乐。</r>\r\n
adv_dear_amao_020.txt,112,2,1,{user},麻央さんのイメージアートが\nプリントされたこのシャツも、,这件印着麻央小姐形象图的T恤，,,<r\=麻央さんのイメージアートが>这件印着麻央小姐形象图的T恤，</r>\r\n
adv_dear_amao_020.txt,211,2,1,麻央,そういうこともあるんだって、\nわかったから……,自从明白这个道理后......,,<r\=そういうこともあるんだって、>自从明白这个道理后......</r>\r\n
adv_dear_amao_020.txt,231,2,1,{user},あなたのことを、\n好きにならせてみせますと。,说要让您喜欢上自己。,,<r\=あなたのことを、>说要让您喜欢上自己。</r>\r\n
adv_dear_fktn_001.txt,103,2,1,{user},担当アイドルの活躍いかんに\nよって決まってきます。,取决于负责偶像的活跃程度。,,<r\=担当アイドルの活躍いかんに>取决于负责偶像的活跃程度。</r>\r\n
adv_dear_fktn_002.txt,58,2,1,ことね,いきなりダメダメなところ\n見られちゃってぇ、,突然被人看到这么糟糕的样子，,,<r\=いきなりダメダメなところ>突然被人看到这么糟糕的样子，</r>\r\n
adv_dear_fktn_002.txt,62,2,1,ことね,見限られちゃったかなーって\nビビってるんですぅ！,我怕你会觉得我没希望了啦！,,<r\=見限られちゃったかなーって>我怕你会觉得我没希望了啦！</r>\r\n
adv_dear_fktn_003.txt,167,2,1,{user},アルバイトを、すべてやめるわけには\nいかないはずです。,确实没法完全放弃打工。,,<r\=アルバイトを、すべてやめるわけには>确实没法完全放弃打工。</r>\r\n
adv_dear_fktn_003.txt,174,2,1,{user},それを、見つけてきます。\nいえ、実は、もう見つけてあります。,不，其实已经找到了。,,<r\=それを、見つけてきます。>不，其实已经找到了。</r>\r\n
adv_dear_fktn_003.txt,253,2,1,{user},今日のプロデュース状況を\nメモしておこう。,记录下今天的培育情况吧。,,<r\=今日のプロデュース状況を>记录下今天的培育情况吧。</r>\r\n
adv_dear_fktn_005.txt,217,2,1,ことね,あたしのことホントに\n好きなんですかぁ！？,你真的喜欢我吗！？,,<r\=あたしのことホントに>你真的喜欢我吗！？</r>\r\n
adv_dear_fktn_005.txt,271,2,1,ことね,（どーせまたヘンテコな仕事\nなんだろーけど）,（反正肯定又是些奇怪的活儿吧）,,<r\=（どーせまたヘンテコな仕事>（反正肯定又是些奇怪的活儿吧）</r>\r\n
adv_dear_fktn_007.txt,18,2,1,ことね,いきなり不吉なコト\n言わないでくださいよ！,不要突然说这种不吉利的话啊！,,<r\=いきなり不吉なコト>不要突然说这种不吉利的话啊！</r>\r\n
adv_dear_fktn_008.txt,183,2,1,ことね,なんで会長、あたしのPVなんか\nチェックしてんの……？,为什么会长会看我的PV啊……？,,<r\=なんで会長、あたしのPVなんか>为什么会长会看我的PV啊……？</r>\r\n
adv_dear_fktn_009.txt,82,2,1,ことね,あたしぃ、ジェットコースターに\n乗ってみたいです！,我想试试坐过山车！,,<r\=あたしぃ、ジェットコースターに>我想试试坐过山车！</r>\r\n
adv_dear_fktn_009.txt,247,2,1,ことね,くすぐったい気持ちだったのは、\n覚えてます。,不过记得当时心里痒痒的感觉。,,<r\=くすぐったい気持ちだったのは、>不过记得当时心里痒痒的感觉。</r>\r\n
adv_dear_fktn_010-01.txt,40,2,1,ことね,もう何ヶ月も一緒に過ごしてきたような\n気がしてました。,和制作人一起相处好几个月了呢。,,<r\=もう何ヶ月も一緒に過ごしてきたような>和制作人一起相处好几个月了呢。</r>\r\n
adv_dear_fktn_010.txt,86,2,1,ことね,学園に入るのにも、\nたくさんおカネがかかることとか……,入学需要大量费用这件事……,,<r\=学園に入るのにも、>入学需要大量费用这件事……</r>\r\n
adv_dear_fktn_010.txt,92,2,1,ことね,アイドルになれなかったときの\nこととか……,要是当不成偶像该怎么办这种事……,,<r\=アイドルになれなかったときの>要是当不成偶像该怎么办这种事……</r>\r\n
adv_dear_fktn_013.txt,110,2,1,星南,ことねを手に入れるのを\n諦めさせたのだもの。,不得不放弃得到琴音这件事呢。,,<r\=ことねを手に入れるのを>不得不放弃得到琴音这件事呢。</r>\r\n
adv_dear_fktn_013.txt,312,2,1,ことね,あたしのことを好きすぎて\n目が曇ってんナ～って。,因为太喜欢我都看不清现实了啦～,,<r\=あたしのことを好きすぎて>因为太喜欢我都看不清现实了啦～</r>\r\n
adv_dear_fktn_014.txt,122,2,1,星南,お気に入りのアイドルグッズを\n飾る祭壇よ。,用来展示心爱偶像周边的祭坛哦。,,<r\=お気に入りのアイドルグッズを>用来展示心爱偶像周边的祭坛哦。</r>\r\n
adv_dear_fktn_014.txt,131,2,1,ことね,あたしのグッズばっか\nなんですけどォ！？,为什么全都是我的周边啊！？,,<r\=あたしのグッズばっか>为什么全都是我的周边啊！？</r>\r\n
adv_dear_fktn_014.txt,153,2,1,ことね,（プロデューサー！　やっぱり誤解じゃ\nなかったんじゃねーの！？）,（制作人！果然之前不是误会吧！？）,,<r\=（プロデューサー！　やっぱり誤解じゃ>（制作人！果然之前不是误会吧！？）</r>\r\n
adv_dear_fktn_014.txt,161,2,1,ことね,（あたしこの家から\n無事に帰れんのかな……）,（我还能活着离开这个家吗……）,,<r\=（あたしこの家から>（我还能活着离开这个家吗……）</r>\r\n
adv_dear_fktn_014.txt,215,2,1,星南,今日のミーティングは、\nこのグッズについての相談と――,今天的会议要讨论这个周边的事情——,,<r\=今日のミーティングは、>今天的会议要讨论这个周边的事情——</r>\r\n
adv_dear_fktn_014.txt,231,2,1,星南,『N.I.A』で競い合うライバルたちに\nついて説明するわ。,我来讲解在『N.I.A』中竞争的对手们。,,<r\=『N.I.A』で競い合うライバルたちに>我来讲解在『N.I.A』中竞争的对手们。</r>\r\n
adv_dear_fktn_014.txt,239,2,1,星南,映像に注目して頂戴。ことねが\n『N.I.A』の制覇を目指すにあたって、,请仔细看画面。琴音想要称霸『N.I.A』，,,<r\=映像に注目して頂戴。ことねが>请仔细看画面。琴音想要称霸『N.I.A』，</r>\r\n
adv_dear_fktn_014.txt,243,2,1,星南,もっとも大きな障害となるのが、\n極月学園のアイドルたちよ。,最大的障碍就是极月学园的偶像们。,,<r\=もっとも大きな障害となるのが、>最大的障碍就是极月学园的偶像们。</r>\r\n
adv_dear_fktn_014.txt,296,2,1,ことね,初星学園をライバル視している……\nって噂は聞いてます。,听说他们把初星学园视为劲敌……,,<r\=初星学園をライバル視している……>听说他们把初星学园视为劲敌……</r>\r\n
adv_dear_fktn_014.txt,321,2,1,星南,要所となるオーディションには、\n精鋭を複数人送りこんでくるのよ。,会在关键赛事派出多名精锐选手参加。,,<r\=要所となるオーディションには、>会在关键赛事派出多名精锐选手参加。</r>\r\n
adv_dear_fktn_014.txt,327,2,1,ことね,うわ露骨……絶対勝てないじゃん……\nそんなの……,这也太直白了吧……根本赢不了啊……,,<r\=うわ露骨……絶対勝てないじゃん……>这也太直白了吧……根本赢不了啊……</r>\r\n
adv_dear_fktn_014.txt,379,2,1,星南,これはプロデューサーの\n意志でもあるの。,这也是制作人的意思哦。,,<r\=これはプロデューサーの>这也是制作人的意思哦。</r>\r\n
adv_dear_fktn_015.txt,140,2,1,{user},オーディションに向けて、\nファンを増やしていこうという話です。,在讨论如何为选拔赛增加粉丝。,,<r\=オーディションに向けて、>在讨论如何为选拔赛增加粉丝。</r>\r\n
adv_dear_fktn_015.txt,146,2,1,ことね,超アウェーだし、プロデューサーが\nなかなか帰ってこないからぁ。,完全是客场作战，制作人又迟迟不回来。,,<r\=超アウェーだし、プロデューサーが>完全是客场作战，制作人又迟迟不回来。</r>\r\n
adv_dear_fktn_015.txt,151,2,1,ことね,ついさっきまで、\nすっごく不安だったんですからね！,直到刚才我还超级不安的！,,<r\=ついさっきまで、>直到刚才我还超级不安的！</r>\r\n
adv_dear_fktn_019.txt,136,2,1,星南,愛しい<em>ライバル</em>の晴れ舞台を\n見届けたら…………,既然已经见证了可爱对手的华丽演出......,,<r\=愛しいライバルの晴れ舞台を>既然已经见证了可爱对手的华丽演出......</r>\r\n
adv_dear_fktn_020.txt,125,2,1,ことね,藤田家の超色々祝賀パーティに\n出席してください！！,请来参加藤田家的超级庆祝派对！！,,<r\=藤田家の超色々祝賀パーティに>请来参加藤田家的超级庆祝派对！！</r>\r\n
adv_dear_fktn_020.txt,132,2,1,ことね,そんで家族への紹介やり直し\nさせてください！！,然后让我重新向家人介绍您！！,,<r\=そんで家族への紹介やり直し>然后让我重新向家人介绍您！！</r>\r\n
adv_dear_hrnm_001.txt,103,2,1,莉波,こんな素敵なプロデューサーさんに\nなってるなんて。,居然成为了这么出色的制作人。,,<r\=こんな素敵なプロデューサーさんに>居然成为了这么出色的制作人。</r>\r\n
adv_dear_hrnm_004.txt,161,2,1,麻央,少なくとも、素質を見抜く目はある、\nプロデューサーなんだろうけど。,他确实有识别才能的眼光吧。,,<r\=少なくとも、素質を見抜く目はある、>他确实有识别才能的眼光吧。</r>\r\n
