id,name,text,trans
0000000000000,千奈,んぐぐぐ……！,嗯呜呜……！
0000000000000,広,んっ、んっ、んっ……！,嗯、嗯、嗯……！
0000000000000,佑芽,……ふ、ふたりとも……\nカラダかったいねぇ～……,……呼、你们两个……\n身体好僵硬啊～
0000000000000,佑芽,ほんとにそれ以上、曲がらないの？,真的弯不下去了吗？
0000000000000,千奈,ん～～～～～～～～～っ！　\nん～～～～～～～～～～～～～～っ！,嗯～～～～～～～～～！\n嗯～～～～～～～～～～～～～～！
0000000000000,広,むぐぐぐぐ…………！,唔呜呜呜…………！
0000000000000,佑芽,…………う～～～～～～ん。,…………嗯～～～～～～～。
0000000000000,佑芽,千奈ちゃん、背中押してあげるね！,千奈酱，我来帮你压后背哦！
0000000000000,千奈,あ、ちょ……お待ちにっ……,啊，等……等一下……
0000000000000,千奈,ぎにゃああああああああああ！！,嘎呀啊啊啊啊啊啊啊！！
0000000000000,千奈,うぅ……\nひどい目に遭いましたわぁ……,呜……\n真是受够了啊……
0000000000000,{user},レッスンお疲れ様でした、\n倉本さん。,训练辛苦了，\n仓本同学。
0000000000000,千奈,先生！　えへへ……お顔を拝見したら、\n疲れなんて吹き飛びましたわっ！,老师！嘿嘿……看到您的脸，\n疲惫就一扫而空了呢！
0000000000000,千奈,わたくしになにか、\n良いお話があるのでしょ？,您是不是有什么\n好消息要告诉我呀？
0000000000000,千奈,先生のお顔に、\nそう書いてありますわっ！,您的脸上\n都写着呢！
0000000000000,{user},慧眼ですね。実は……\nまた学園長と話をしてきました。,真是慧眼如炬。其实……\n我又和校长谈过了。
0000000000000,千奈,え゛…………,诶…………
0000000000000,千奈,わ、わたくし……とても嫌な予感が\nしてきましたわ……,我、我……有种非常不好的\n预感啊……
0000000000000,学園長,倉本爺からの\n追加リクエストを伝える！,传达仓本老爷子的\n追加要求！
0000000000000,学園長,倉本千奈のプロデュース。\n月末までに大きな成果を上げよッ！,仓本千奈的培育计划。\n月底前必须取得重大成果！
0000000000000,千奈,お爺様ぁ～～～～～～～～！\nいい加減にしてくださいませぇ！？,爷爷～～～～～～～～！\n请您适可而止好吗！？
0000000000000,千奈,わたくし、レッスンにも付いていけない\n学園最底辺のアイドルですのにぃ！,我可是连训练都跟不上\n学院垫底的偶像啊！
0000000000000,千奈,月末までに大きな成果だなんて……！,月底前取得重大成果什么的……！
0000000000000,千奈,も、もし……リクエストに\n応えられなければ……？,要、要是……\n达不到要求的话……？
0000000000000,{user},クビでしょうね。,大概会被开除吧。
0000000000000,千奈,ふぇぇぇ～～～～～～～～～～～！\nど～しますのぉ～～～～～～～～っ！,呜呜呜～～～～～～～～～～～！\n这该怎么办啊～～～～～～～～！
0000000000000,千奈,期限が短すぎて、\nごまかしようがありませんわ！！,期限这么短，\n连糊弄的机会都没有！！
0000000000000,{user},リクエストを達成しましょう。,我们来达成这个要求吧。
0000000000000,千奈,……へっ？,……诶？
0000000000000,{user},いますぐに大きな成果を出す、\nということです。,就是立即取得\n重大成果的意思。
0000000000000,千奈,……わたくしが、ですの？,……让我来吗？
0000000000000,{user},もちろん、倉本さんが、です。,当然是你，仓本同学。
0000000000000,千奈,で、できるわけありませんわっ！,这、这怎么可能做到啊！
0000000000000,千奈,だってわたくし、歌もダンスも\nへたくそで……体力もなくて……！,因为我唱歌跳舞都不行……\n体力又差…………！
0000000000000,千奈,アイドルとしてステージに上る\n資格なんて、ありませんのにっ！,根本就没资格\n作为偶像站上舞台！
0000000000000,{user},アイドルが活動する舞台は、\nステージの上だけではありませんよ。,偶像活跃的舞台，\n不仅仅是在表演台上哦。
0000000000000,{user},いいですか、倉本さんには、\n大きな才能が2つあります。,听好了，仓本同学\n拥有两大才能。
0000000000000,千奈,そ、それはいったいなんですのっ！？,那、那到底是什么啊！？
0000000000000,{user},1つめは、実家がお金持ちなことです。,第一个是：你家非常有钱。
0000000000000,千奈,先生っ、怒りますわよ！！,老师！我要生气了！！
0000000000000,{user},ふざけているわけではありません。\nとてつもなく強力な才能です。,我并不是在开玩笑。\n这是极其强大的才能。
0000000000000,千奈,でも……それは……,但是……这……
0000000000000,千奈,わたくし自身に備わっているもの\nではありませんもの。,这并非我自身\n具备的东西呀。
0000000000000,{user},しかし、自分の意志で取り外す\nことのできないものでもあります。,但这也是你无法\n凭自己意志卸下的东西。
0000000000000,千奈,……おっしゃるとおりですわ。,……您说得对。
0000000000000,千奈,先生。わたくしは\nとても恵まれていて……,老师。我\n非常幸运……
0000000000000,千奈,不自由なく育ち、夢を目指して\n学ぶことができています。そして……,从小生活优渥，能够自由地\n追逐梦想接受教育。而且……
0000000000000,千奈,わたくしの今後のアイドル活動に……\n倉本の名とお金が必ず使われる。,今后我的偶像活动……\n必定会动用仓本家的名号与资金。
0000000000000,千奈,他のアイドルの皆様よりも、\nずっとずっと有利になりますわ。,比起其他偶像们，\n我拥有压倒性的优势呢。
0000000000000,千奈,先生のおっしゃる才能とは、\nこのことですわね。,老师所说的才能，\n就是指这个吧？
0000000000000,千奈,恵まれているわたくしには……\nズルいと言う資格さえないのでしょう。,像我这样得天独厚的人……\n连指责别人作弊的资格都没有呢。
0000000000000,千奈,せめて……\n濫用はしないでくださいませ！,至少……\n请不要滥用这份特权！
0000000000000,{user},約束します。,我保证。
0000000000000,{user},あなたの稀有な才能。\n必要な時に、必要なだけの量を使うと。,你这份稀有的才能。\n只在必要时，使用必要的量。
0000000000000,千奈,そうしてくださいな。それで……\n2つ目の才能はなんですの？,请务必遵守。那么……\n第二个才能是什么呢？
0000000000000,{user},外見です。,是外貌。
0000000000000,千奈,が、外見……ですの？,外、外貌……？
0000000000000,{user},アイドルとしての\n技術こそ未熟ですが……,虽然作为偶像的\n技术尚不成熟……
0000000000000,{user},倉本さんの外見は、トップアイドルと\n比較しても決して劣るものではない。,但仓本小姐的外貌，即使与顶级偶像\n相比也绝不逊色。
0000000000000,千奈,そっ、そんな……！,怎、怎么会……！
0000000000000,千奈,初星学園には、わ、わたくしよりも\n可愛らしいアイドルがたくさん……,初星学园里比我……比我\n可爱的偶像明明大有人在……
0000000000000,{user},歩く姿勢、立ち姿、話す際の表情、\n様々な状況下での作法等々……,行走的姿态，站立的仪态，\n交谈时的表情，各种场合的礼节……
0000000000000,{user},倉本さんは、あらゆる所作が美しい。\n他のアイドルにはないものです。,仓本小姐每个举止都优雅得体。\n这是其他偶像所不具备的。
0000000000000,千奈,そ、そそ……そう、なのでしょうか？　\nよく……わかりませんわ。,真、真的……是这样吗？\n我……不太明白呢。
0000000000000,{user},姿形の美しさ、愛らしさ、立ち居\n振る舞いから滲み出る育ちの良さ。,外形的美丽，惹人怜爱的气质，\n举止间流露出的良好教养。
0000000000000,{user},磨き抜かれた『外見』は、\n今後とも頼れる武器になるでしょう。,这份精雕细琢的『外貌』，\n今后也将成为可靠的武器。
0000000000000,千奈,え、えへへ……先生ったら！\nもうっ！　もううっ！！,哎、哎嘿嘿……老师真是的！\n够了啦！真是的！！
0000000000000,千奈,そんなにわたくしを褒めて\nどうなさるおつもりですのっ♡,这样拼命夸奖我\n到底有什么企图呀♡
select,,モデルとして雑誌に出てもらおうかと,要不要试试以模特身份登上杂志？
0000000000000,千奈,……えっ？,……咦？
0000000000000,{user},わかりやすい成果物を以て、\n小リクエスト達成を目指しましょう！,通过直观的成果物\n来达成小目标吧！
0000000000000,千奈,わ、わわわ、わたくしが……\nモデルの……お仕事を……？,我、我我我、我竟然……\n要当……模特……？
0000000000000,{user},お願いできませんか？　\nこの首をつなげるために。,可以拜托你吗？\n为了保住我的饭碗。
0000000000000,千奈,お、おおお、お任せくださいませっ！\n先生のお願いとあらばっ――,请、请请请交给我吧！\n既然是老师的请求——
0000000000000,千奈,わたくし“ふぉとじぇにっく”な\nアイドルになってみせますわっ！,我一定会成为“photogenic”的\n完美偶像的！
0000000000000,{user},一度、レポートをまとめなおそう。,重新整理一下报告吧。
0000000000000,{user},さて、どんなフォトジェニックな\nアイドルになってくれるのか楽しみだ。\n,那么，就期待你会成长为\n怎样耀眼的全能偶像了。
info,adv_dear_kcna_006.txt,,
译者,Pro/deepseek-ai/DeepSeek-V3,,
