id,name,text,trans
0000000000000,{user},ウォークラリーで助言や挨拶……\n忙しい仕事ですね。,定向越野活动中既要提供建议又要打招呼……\n真是忙碌的工作呢。
0000000000000,咲季,街中だし大丈夫よ。\n休憩所もあるもの。,在市区里没关系的。\n而且也有休息点。
select,,迷子に\n気をつけて,要小心\n迷路的孩子
select,,車に気をつけて,注意来往车辆
select,,熱中症に\n気をつけて,当心\n中暑
0000000000000,咲季,そうね。小さな子もいるし……\nしっかり楽しんでもらわなきゃ。,说得对。毕竟还有小朋友在……\n必须让大家玩得尽兴才行。
0000000000000,{user},ウォークラリーは無事終了。\n咲季さんもアピールできたな。,定向越野活动顺利结束。\n咲季同学也成功展现了魅力呢。
0000000000000,咲季,もちろん。子供が走り回らないように\nするための見回りでもあるんだから。,那当然。毕竟我还要巡视\n防止小朋友们到处乱跑。
0000000000000,{user},ウォークラリーは無事終了。\n咲季さんもアピールできたな。,定向越野活动顺利结束。\n咲季同学也成功展现了魅力呢。
0000000000000,咲季,ええ。季節関係ないものね。\n参加者にも水分補給するように言うわ。,嗯。这和季节没关系呢。\n我会提醒参赛者及时补充水分的。
0000000000000,{user},ウォークラリーは無事終了。\n咲季さんもアピールできたな。,定向越野活动顺利结束。\n咲季同学也成功展现了魅力呢。
info,adv_pevent_002_hski_sales_2-006-01.txt,,
译者,Pro/deepseek-ai/DeepSeek-V3,,
