id,name,text,trans
0000000000000,佑芽,今日はお休みですよっ、\nプロデューサーさんっ！,今天休息日哦，\n制作人先生！
0000000000000,佑芽,さっそく遊びに行きましょう！,我们赶紧去玩吧！
select,,咲季さんを\n誘ってください,请把咲季同学\n也一起叫上
select,,休養日なので\nほどほどに,因为是调休日\n请注意适度
0000000000000,佑芽,休日のお姉ちゃんは、ものすごぉ～～く\n付き合いが悪いんです！,休息日的姐姐啊，超级超级～\n难约的！
0000000000000,佑芽,全力で休養するわ！　って、\n一日中ジッとしているんですよ！,说什么“要全力休养！”\n结果一整天都瘫着不动呢！
0000000000000,{user},咲季さんらしいですね。\nそこは真似しないんですか？,很有咲季同学的风格呢。\n你不学她那样吗？
0000000000000,佑芽,うぐぐ～……ジッとしていると、,呜呜～……要我静止不动的话，
0000000000000,佑芽,30秒くらいで、\nもう無理～ってなるんです！,30秒左右就\n坚持不下去啦！
0000000000000,佑芽,プロデューサーさんまで、\nお姉ちゃんみたいなことを言う～！,连制作人先生都\n和姐姐说一样的话～！
0000000000000,佑芽,ちゃんと休むのが大事って、\nそれはわかってるんですけど……,好好休息很重要\n这个道理我也懂啦……
0000000000000,佑芽,大人しくジッとしていると、\nそわそわしてきちゃうんです～～！,但是要安静待着的话\n我就会坐立不安啊～～！
0000000000000,佑芽,なんとかしてください\nプロデューサーさぁん！,快想想办法嘛\n制作人先～生！
0000000000000,佑芽,一緒に遊びましょう！　\n一緒にどこか行きましょう！,一起玩吧！\n带我去哪里逛逛嘛！
0000000000000,{user},……わかりました。,……知道了。
0000000000000,佑芽,やったぁ～～～！,太好啦～～～！
0000000000000,佑芽,なら、さっそくミーティングですね！,那就立刻开作战会议吧！
0000000000000,{user},み、ミーティング？,作、作战会议？
0000000000000,佑芽,はいっ、今日を楽しい休日に\nするための、ミーティングです！,没错！为了让今天成为快乐假日\n的作战会议！
0000000000000,佑芽,お互いに意見を出し合って、\n計画を立てるんです！,大家互相提建议\n制定计划呀！
0000000000000,{user},当日にやることではないですが……\n佑芽さんらしいですね。,这不该是当天才做的事吧……\n不过很有佑芽同学的风格呢。
0000000000000,佑芽,無計画ですみません！,抱歉我太没计划性啦！
0000000000000,佑芽,<em>次</em>は、ちゃんと事前に相談しますね！,下次会提前好好商量的！
0000000000000,佑芽,さぁっ、プロデューサーさん――,来吧，制作人先生——
0000000000000,佑芽,楽しい休日のはじまりですよ！,快乐假日的序幕要拉开啦！
info,adv_pstory_001_hume_ending-normal-01.txt,,
译者,Pro/deepseek-ai/DeepSeek-V3,,
