id,name,text,trans
0000000000000,広,佑芽、大切な話がある。,佑芽，我有重要的话要说。
0000000000000,佑芽,広ちゃん、どうしたの？　改まって。,小广怎么了？这么郑重其事的。
0000000000000,広,わたしの……どんなところが、好き？,你喜欢我……什么地方？
0000000000000,佑芽,ええっ！？,诶！？
0000000000000,千奈,きゅ、急にとんでもない会話が\n始まりましたわ……,呜、呜啊……突然就展开了不得了的对话\n了呀……
0000000000000,広,次は千奈にも聞く。,等下也会问千奈。
0000000000000,千奈,はわっ！？　わたくしにも！？,哇啊！？连我也要问吗！？
0000000000000,広,わたしの魅力を\n言語化してみよう、という課題。,这是个课题，试着用语言表达\n我的魅力。
0000000000000,千奈,あっ……そういうことでしたのね……,啊……原来是这么回事啊……
0000000000000,佑芽,えっと……あたしが思う、\n広ちゃんの魅力はね～。,那个……我觉得啊，\n小广的魅力嘛～。
0000000000000,佑芽,ユニークなところかな！,就是很特别！
0000000000000,佑芽,いままでに会った誰とも違う、\n独特の雰囲気っていうか……,和至今为止见过的任何人都不一样，\n有种独特的气场……
0000000000000,佑芽,一緒に、同じ方向に向かって\n走っているはずなのに……,明明应该是一起\n朝着同一个方向奔跑的……
0000000000000,佑芽,見回してもどこにもいなくて、なのに\nしっかりと……気配だけがそばにいて。,环顾四周却哪儿都找不到人，但又能\n真切地感受到……你就在身边。
0000000000000,佑芽,なんだか、嬉しくなるんだ。,不知为何，会觉得很开心。
0000000000000,佑芽,ん～、ごめんね……\nうまくいえなくて。,嗯～对不起……\n我说不太好。
0000000000000,佑芽,だけどあたし……\n広ちゃんのこと、大好きだよ。\n,可是我……\n最喜欢小广你了。
0000000000000,広,ありがとう。\nわたしも、佑芽のこと、好き。,谢谢。\n我也喜欢你，佑芽。
0000000000000,千奈,わたくしは……篠澤さんの……\n凪いだ海のような心が好きですわ。,我……喜欢篠泽小姐\n那如平静大海般的心灵。
0000000000000,千奈,広くて、豊かで、穏やかで……\n底知れない。,宽广、丰沛、温柔……\n又深不可测。
0000000000000,千奈,そばにいると、\n安心した気持ちになるのです。,待在您身边时，\n就会感到安心。
0000000000000,千奈,わたくしとよく似た境遇で……\nいつもすごくがんばっていらして。,明明和我的境遇很相似……\n却总是那么努力。
0000000000000,千奈,励みになっていますわ、とても。,给了我很大鼓舞。
0000000000000,広,千奈こそ……いつも、わたしのお手本。\n可愛くて、綺麗なアイドル。,千奈才是……一直是我的榜样。\n可爱又美丽的偶像。
0000000000000,千奈,……て、照れちゃいますわ。,……好、好难为情啊。
0000000000000,千奈,きっと、そういうところが……,说不定……这就是……
0000000000000,千奈,篠澤さんの\n魅力なのかもしれませんわね。,或许这正是篠泽小姐的\n魅力所在呢。
0000000000000,手毬,は？　あなたの魅力？\nなんで私に聞くの？,哈？你的魅力？\n为什么要问我？
0000000000000,広,美鈴に聞こうとしたら、\n見つからなかった。,想找美铃问的，\n但没找到人。
0000000000000,広,そういえば手毬も、\nわたしのこと、好きだったなって。,说起来手毬你也\n说过喜欢我吧。
0000000000000,手毬,好きじゃないし。,才不喜欢。
0000000000000,手毬,というか、よくしらないし。\n魅力なんて聞かれても……困る。,而且我也不太了解你。\n突然问魅力什么的……很困扰啊。
0000000000000,手毬,私にとって、あなたは……,对我来说，你就是……
0000000000000,手毬,いっつも調子を狂わせてくる、\n変なやつだよ。,总打乱我节奏的\n怪家伙啦。
0000000000000,学園長,…………えっ、わしにも聞くの？,…………啊？连我也要问？
0000000000000,広,おじいちゃんは、入試面接でわたしを、\nいちばん高く評価してくれた人だから。,因为爷爷在入学面试时\n给了我最高评价。
0000000000000,広,わたしの魅力、しってるかなって。,我想您应该知道我的魅力所在。
0000000000000,学園長,ハッハッハ、もちろん知っておるぞ！,哈哈哈，当然知道！
0000000000000,学園長,篠澤広君、おぬしの魅力は――,篠泽广啊，你的魅力就在于——
0000000000000,学園長,まさしくそういうところじゃ。,正是这一点啊。
0000000000000,学園長,次に、なにをしでかすかわからない。\n見ていて飽きぬその在り方は、,永远猜不到你接下来要做什么，\n这份让人看不厌的特质，
0000000000000,学園長,輝かしい経歴や才をすべて投げ捨て、\nアイドルへと転身したいまもなお……,即便抛下辉煌经历与才能\n转行成为偶像的现在……
0000000000000,学園長,確かに残るものであろう。,也依然如故吧。
0000000000000,広,……………………困った。,……………………真头疼。
0000000000000,広,みんな、ばらばらなことを言う。,大家说的都不一样。
info,adv_cidol-shro-3-001_02.txt,,
译者,Pro/deepseek-ai/DeepSeek-V3,,
