id,name,text,trans
0000000000000,咲季,うっ……うぐっ………………,呜……嗯呜………………
0000000000000,咲季,よかったぁ……よかったわっ！\n努力が実を結んだのね……！,太好了……真的太好了！\n努力终于得到回报了呢……！
0000000000000,咲季,もう、この先の戦いが\nますます楽しみになっちゃうじゃない。,这样下去\n我对今后的战斗越来越期待了呢。
0000000000000,咲季,わたし、知らなかったわ……！,我都不知道……！
0000000000000,咲季,こんなにおもしろい作品が\nあったなんて！,原来还有这么有趣的作品\n存在啊！
0000000000000,咲季,店員さんがあれだけおすすめ\nしてたのも、納得できるわね。,难怪店员小姐会那么极力\n推荐呢。
0000000000000,咲季,プロデューサーも、\nそう思うでしょう！？,制作人也是\n这么觉得的吧！？
0000000000000,{user},はい、とても感動的な内容でしたね。,是的，是非常感人的故事呢。
0000000000000,咲季,そうでしょ、そうでしょ……！\nアニメっておもしろいのね！,对吧对吧……！\n动画原来这么有意思啊！
0000000000000,咲季,次はなにを観ようかしら！,接下来该看什么呢！
0000000000000,咲季,たしか、アニメイトでお客さんが\nグッズをたくさん買ってたやつが――,对了，在animate看到很多客人\n都在买周边的那部——
0000000000000,{user},まだ観るんですか？\nその作品はかなり話数がありますが……,还要继续看吗？\n这部作品集数相当多哦……
0000000000000,咲季,当然よ！　まだまだお客さんのことを\n知りたいもの！,当然啦！我还想更多地\n了解客人们呢！
0000000000000,咲季,せっかくの休日なんだし、\n時間は有効に使わないとね。,难得休息日\n必须要好好利用时间才行。
0000000000000,{user},気持ちはわかりますが、\n一度休憩を挟みましょう。,我明白你的心情\n但先休息一下吧。
0000000000000,{user},もう何時間も、\n続けて観ているでしょう。,你已经连续看了\n好几个小时了吧。
0000000000000,咲季,あら、もうそんなに時間が\n経ってたのね。,哎呀，已经过去\n这么久了吗。
0000000000000,咲季,わかったわ。スポーツでもなんでも、\n適度な休憩は大切だもの。,知道啦。不管是运动还是什么\n适当休息都很重要呢。
0000000000000,咲季,……ねえ、プロデューサー。,……呐，制作人。
0000000000000,咲季,この仕事を……どうしてわたしに？,为什么要把这份工作
0000000000000,咲季,アニメにも、漫画にも、\nまったく詳しくないのよ？,我对动画啊漫画啊\n明明完全不了解的？
0000000000000,{user},知識の有無は、重視していません。,我并不看重知识储备。
0000000000000,{user},少なくとも、咲季さん相手なら\n考慮する必要はないかと。,至少对于咲季小姐来说\n完全不需要考虑这个问题。
0000000000000,咲季,わたし相手なら？,对我而言？
0000000000000,{user},咲季さんは、見栄っ張りですから。,因为咲季小姐是爱逞强的人啊。
0000000000000,咲季,はぁっ！？,哈啊！？
0000000000000,{user},あなたは、まったく無知の状態で\n挑むことはしないはずです。,你绝对不会以完全无知的状态\n去迎接挑战的。
0000000000000,{user},かならず全力で取り組んで、良い結果を\n出してくれると信じていました。,我相信你一定会全力以赴\n交出漂亮的答卷。
0000000000000,咲季,ふ、ふぅ～ん……？,哼、哼～……？
0000000000000,{user},そして、咲季さんが\n今まで触れずにいた場所にこそ――,而且正因咲季小姐\n从未涉足的领域——
0000000000000,{user},まだ、花海咲季というアイドルを\n知らない人が多い。,还有很多人不知道\n花海咲季这位偶像的存在。
0000000000000,咲季,！　……それが狙いってワケ。,！……原来这才是目的啊。
0000000000000,{user},はい。ですから、まだあなたを\n知らない人たちに――,没错。所以要让那些\n还不认识你的人——
0000000000000,{user},こんなに素敵なアイドルがいたなんて、\nと思わせてやりましょう。,要让人们惊叹竟有如此出色的偶像，\n就让我们来实现吧。
0000000000000,咲季,ずいぶんと、\n信頼してくれてるじゃない……,你倒是……\n很信任我呢……
0000000000000,咲季,いいわ。\n店長としても、アイドルとしても……,好啊。\n不论是作为店长还是偶像……
0000000000000,咲季,誰よりも店を盛り上げてみせる！,我要让这家店比任何地方都热闹！
0000000000000,咲季,そして、店に来た人全員――\n花海咲季の虜にしてあげるわ！,然后让所有来店的客人——\n都成为花海咲季的俘虏！
info,adv_cidol-hski-3-006_03.txt,,
译者,Pro/deepseek-ai/DeepSeek-V3,,
