id,name,text,trans
0000000000000,ことね,クリスマスを体験するぅ～？　\nなんですかぁ、それ？,要体验圣诞节～？\n这是什么意思啊？
0000000000000,{user},アイドルにとって\n季節のイベントとは仕事です。,对偶像来说\n季节性活动就是工作。
0000000000000,{user},人気が出れば出るほど、\n一般的な過ごし方などできなくなる。,人气越高，\n就越没法像普通人那样过节。
0000000000000,ことね,それはまぁ……そですね。\n人気アイドルって休みないですし。,这个嘛……确实呢。\n当红偶像基本没有假期。
0000000000000,{user},一方で、ファンにイベントを\n楽しんでもらおうとするなら――,反过来想，要让粉丝在活动中\n能够享受的话——
0000000000000,{user},アイドルには、たくさんのイベントを\n『楽しんできた経験』が求められます。,对偶像来说，就需要具备\n“享受过众多活动”的经验。
0000000000000,ことね,あー……プロデューサーが言いたいこと\nわかったかも～。,啊……我好像明白制作人\n想说什么了～
0000000000000,ことね,あたし、そーゆーイベントごとって、\n家族と過ごした経験ばっかです。,我这种节日啊……\n基本上都是和家人一起过的。
0000000000000,ことね,今年だって……もし、もしもですけど。\n<em>プロデューサーと出逢ってなければ</em>……,今年也是……如果、只是假设啦，\n要是没遇见制作人的话……
0000000000000,ことね,クリスマスは、割のいいバイト探したり\nして、過ごしてたと思いますし。,圣诞节肯定是在找高薪兼职\n之类的事情中度过的吧。
0000000000000,ことね,そんなやつがクリスマスの歌とか……\nだめですよね。,像我这样的人唱圣诞歌什么的……\n果然不行吧。
0000000000000,{user},だめではないです。\nそれはそれでアリです。,没什么不行的。\n那样也很真实。
0000000000000,ことね,（この人、あたしが自虐っぽくなると、\nすごい勢いで全肯定してくる……）,（这人每次我自嘲的时候\n就会全力肯定我……）
0000000000000,{user},家族と過ごすのも、アルバイトをして\n過ごすのも、大切な経験。,无论是和家人共度\n还是打工度日，都是珍贵的经历。
0000000000000,{user},アイドルにとっては、\n人生すべてが武器ですよ。,对偶像来说，\n整个人生都是武器哦。
0000000000000,ことね,ったくもー、プロデューサーってば、\nあたしのこと好きすぎ～♡,真是的～制作人你呀，\n也太宠我了吧～♡
0000000000000,ことね,それはそれとして、,不过话说回来，
0000000000000,ことね,『普通のクリスマス』も経験しておいた\n方がいいんですよね。,确实应该先体验下\n“普通人的圣诞节”呢。
0000000000000,{user},知名度が高まり切っていない今の\nうちに、体験してしまいましょう。,趁现在知名度还没太高，\n赶快去体验吧。
0000000000000,ことね,クリスマス前に？,在圣诞节之前？
0000000000000,{user},天川のイルミネーションは、\n今夜からだそうですよ。,天川的彩灯\n听说今晚就要亮起来了。
0000000000000,{user},クリスマスの雰囲気を味わうくらい\nなら、十分にできるはずです。,至少感受下圣诞氛围\n应该是没问题的。
0000000000000,ことね,エト、それって……………………,那个，也就是说……………………
0000000000000,ことね,プロデューサーも、\n一緒に来てくれるんです？,制作人也会\n一起来的对吧？
0000000000000,{user},もちろん。,当然。
0000000000000,ことね,へー……,嘿～……
0000000000000,ことね,（デートのお誘いだコレぇ！！！！）,（这这这根本就是约会邀请啊！！）
0000000000000,ことね,ど、どーしよっかなぁ～。,该、该怎么办才好呢～
0000000000000,ことね,（って、もったいぶってる場合\nじゃないケドぉ～～！）,（不对不对现在不是\n装矜持的时候啦～～！）
0000000000000,ことね,（こっ、心の準備～～～～！　\n急げぇ～～～～～～～よしッ！）,（心、心理准备～～～～！\n快点调整状态～～～～～～好！）
0000000000000,ことね,いきましょうプロデューサー！,我们走吧制作人！
0000000000000,ことね,たったいまから、\nクリスマスイブってことで！,从现在开始\n就当是圣诞前夜！
0000000000000,ことね,今夜だけプロデューサーは、\nあたしの彼氏ってことで！,今晚的制作人\n就假装是我男朋友！
0000000000000,ことね,クリスマスデートへ――しゅっぱ～つ♪,圣诞约会——出发♪
info,adv_cidol-fktn-3-006_02.txt,,
译者,Pro/deepseek-ai/DeepSeek-V3,,
