id,name,text,trans
0000000000000,{user},お疲れ様でした、倉本さんは……,辛苦了，仓本同学你……
0000000000000,{user},合格です。ギリギリの結果でしたね。,合格了。真是惊险的结果呢。
0000000000000,千奈,ふふ……うふふ……\n……ギリギリの合格……,呵呵……啊呵呵……\n……勉强及格……
0000000000000,千奈,と！　いうことは！　つまり……\n最下位ではないということッ！,这！也就是说！意味着……\n我不是倒数第一啦！
0000000000000,千奈,ついに……ついにぃ……,终于……终于啊……
0000000000000,千奈,学園最下位、脱出ですわぁ～～～！,成功摆脱学院倒数第一的头衔啦～～～！
select,,よかったですね,太好了呢
select,,驚きました,真是让人惊讶
select,,喜びすぎです,开心过头了哦
0000000000000,千奈,はいっ！　先生のおかげですわ！,是的！都是多亏了老师您！
0000000000000,{user},この調子で、少しずつ\n順位を上げていきましょう。,保持这个势头，\n慢慢提升排名吧。
0000000000000,千奈,わたくしに……できるでしょうか？,我……真的能行吗？
0000000000000,{user},いまは無理でも、\n1ヶ月後ならわかりません。,现在或许不行，\n但一个月后谁说得准呢。
0000000000000,{user},倉本さんの頑張り次第です。,这取决于仓本同学的努力程度。
0000000000000,千奈,や、やってみせますわ！,我、我会证明给您看的！
0000000000000,千奈,わたくし、立派なアイドルに\nなるのですものっ！,因为我要成为\n出色的偶像呀！
0000000000000,{user},あれほど動けなかった倉本さんが、\nこんなに早く結果を出すとは……,没想到当初那么不擅运动的仓本同学，\n这么快就能取得成果……
0000000000000,千奈,え、えぇ～っ、\n先生……褒めすぎですわぁ♡,啊、啊呀～\n老师……您夸得太夸张啦♡
0000000000000,{user},ですが、まだまだ\n平均的なアイドルとは呼べません。,不过距离\n普通偶像的水平还很远。
0000000000000,{user},立派なアイドルには、ほど遠い。,离优秀偶像更是遥不可及。
0000000000000,千奈,ですわよね……,说得对呢……
0000000000000,千奈,わかっておりますわ。……いいえ、\nそうでなくては困りますわ。,我明白的。……不对，\n要是连这点觉悟都没有就糟糕了。
0000000000000,千奈,だって……わたくしにとって、\n生涯初めての夢ですもの。,因为……这可是我有生以来\n第一次怀抱的梦想呀。
0000000000000,千奈,あ、呆れないでくださいませぇ～！,啊～请不要用那种眼神看我啦！
0000000000000,千奈,だって仕方ないじゃありませんの！\nわたくし……わたくし……,这也不能怪我呀！\n毕竟我……我……
0000000000000,{user},入学試験の結果が最下位だったこと。\nそこまで気にしていたんですね。,原来你这么在意\n入学考试垫底的事啊。
0000000000000,千奈,はいっ！　すっごく、すぅ～～っごく、\n気にしておりましたわ！,没错！超级、超级～\n在意的！
0000000000000,{user},いつも誇らしげに口にしていたので、\nてっきり気に入っていたのかと。,看你总是骄傲地挂在嘴边，\n还以为你很喜欢这个称号呢。
0000000000000,千奈,学園最下位の称号を\n気に入る理由ってなんですの！？,谁会喜欢\n“学院倒数第一”这种称号啊！？
0000000000000,{user},最下位から成り上がれる権利を持つ、\n特権階級ともいえますし。,从垫底逆袭的特权，\n也算是特权阶级呢。
0000000000000,千奈,……そのように好戦的な考え方を\nなさるのは、先生と……,……会这么积极看待这件事的，\n除了老师您……
0000000000000,千奈,……わたくしのお友達くらいですわ。,……大概就只有我的朋友了。
0000000000000,千奈,けれど、素敵な考え方。,不过，我很喜欢这种想法。
0000000000000,千奈,どこまで上れるかはわかりませんが、\n精一杯やってみますわね。,虽然不知道能走多远，\n但我会全力以赴的。
info,adv_pstory_001_kcna_after-audition-mid-normal-04.txt,,
译者,Pro/deepseek-ai/DeepSeek-V3,,
