id,name,text,trans
0000000000000,{user},右大臣、左大臣のほうは、\nこんな感じでどうでしょう？,右大臣和左大臣的位置，\n这样摆放如何？
0000000000000,麻央,わ、カッコイイ！,哇，好帅气！
0000000000000,麻央,ふむ、プロデューサーって、\n手先が器用なんですね。,唔……制作人先生\n手很灵巧呢。
0000000000000,{user},プロデューサー科で、裁縫を学べる\n実技科目も履修しているので。,因为在制作人课程里\n我也选修了缝纫实操课。
0000000000000,麻央,そんなことまで学べるんですね、\nプロデューサー科……,原来连这种技能都能学到啊，\n制作人专业……
0000000000000,{user},ライブ直前に、アイドルの衣装が\n破れたりほつれたりしたとき、,演唱会前遇到偶像服装\n破损或开线的情况时，
0000000000000,{user},すぐに繕えるように\nしておかなければなりませんから。,必须提前做好准备\n以便能够立即修补。
0000000000000,麻央,……そ、そうなんだ。,……原、原来如此。
0000000000000,麻央,……大学生って、すごいなぁ。,……大学生真厉害啊。
0000000000000,麻央,まるで魔法使いみたいに、\nなんでもできるんだ。,简直像魔法师一样\n什么都会呢。
0000000000000,{user},そんなことはありませんよ。,没这回事。
0000000000000,{user},小学生のとき、中学生や高校生が\nすごく大人びて見えたでしょう？,你小学时看中学生和高中生，\n也觉得他们很成熟吧？
0000000000000,麻央,……それは、そうですね。,……那倒是。
0000000000000,{user},俺もプロデューサーとしては、\nまだまだ未熟です。,我作为制作人\n也还远远不够成熟。
0000000000000,{user},プロデュースの現場で\n学ぶことは、本当に多い。,在培育现场\n要学的东西实在太多。
0000000000000,麻央,ふふっ、それじゃあ、\nボクと同じですね。,呵呵，这么说来\n和我一样呢。
0000000000000,麻央,3年生になって、キミにプロデュースを\n始めてもらってから、,升入三年级后\n开始接受你的培育以来，
0000000000000,麻央,発見と挑戦と、勉強の日々ですよ。\nすごく……楽しい。,每天都是发现、挑战与学习\n真的……很开心。
0000000000000,{user},それはよかった。――本当に。,那就好。——真心话。
0000000000000,麻央,……これでほぼ完成ですね。\nひな壇に並べてみましょうか。,……这样就基本完成了。\n摆到雏坛上试试看吧。
0000000000000,麻央,お人形いっぱい並べるのって、\nなんだか楽しいですね。,摆满人偶的感觉\n莫名很有趣呢。
0000000000000,{user},そうですね。最適な配置の\nバランスを考えるのは、,是啊，考虑最佳\n配置的平衡，
0000000000000,{user},ステージ演出に通じるところがある。,和舞台调度有共通之处。
0000000000000,麻央,たしかに。人形の角度、視線の誘導、\n照明の強さと角度……,确实。人偶的角度、视线引导、\n灯光的强弱与角度……
0000000000000,{user},失礼しました。舞台演出に関しては、\n麻央さんが先輩でしたね。,失礼了。说到舞台演出\n麻央才是前辈呢。
0000000000000,麻央,ふふっ、まあ、子供の頃から、\n舞台が遊び場でしたからね。,呵呵，毕竟从孩提时代起\n舞台就是我的游乐场了。
0000000000000,麻央,{user}くん。\n先輩と呼んでくれたまえ？,{user}君\n以后就叫前辈吧？
0000000000000,{user},――はい。麻央先輩。,——好的。麻央前辈。
0000000000000,麻央,な、なんだか、こそばゆいですね。\nキミに先輩って呼ばれるの。,被、被你这样称呼\n总觉得有点难为情呢……
0000000000000,麻央,こほん。配置は、こんな感じで\n良さそうですね。,咳咳。摆放位置\n这样应该不错。
0000000000000,麻央,現地のひな壇は七段飾りだから、\nかなり見栄えがすると思いますよ。,现场的雏坛是七层结构\n视觉效果会很壮观哦。
0000000000000,{user},イベントに来たお客さんも、\nきっと、楽しんでくれると思います。,来参加活动的客人\n一定也会很开心的。
0000000000000,麻央,……ふふっ、懐かしいな。,……呵呵，真怀念啊。
0000000000000,麻央,実家にも、両親の買ってくれた\nひな人形のセットがあったんですけど、,老家也有父母买的\n整套雏人偶，
0000000000000,麻央,けっこう本格的な人形で、\n子供の頃はちょっと怖くて、,因为人偶做工太精致\n小时候反而有点害怕，
0000000000000,麻央,でも、だんだん愛着がわいてきて――\nひな祭りが終わった後も、,但渐渐产生感情——\n女儿节过后也经常
0000000000000,麻央,人形とお芝居ごっこしたりして、\nよく遊んでましたね。,和人偶过家家之类的，\n玩得不亦乐乎呢。
0000000000000,{user},子供の頃の麻央さん、\nどんな感じだったんですか？,小时候的麻央\n是什么样子呢？
0000000000000,麻央,え？　ええっと……\n普通の子供でしたよ。,咦？这个嘛……\n就是普通孩子呀。
0000000000000,麻央,近所の森で木登りしたり、\n虫取りをしたり……,在附近森林爬树\n捉虫子之类的……
0000000000000,{user},割とアクティブな子供ですね。,还挺活泼的孩子呢。
0000000000000,麻央,小学生の頃は、お仕事の都合で、\n学校を休みがちだったから、,小学时因为工作关系\n经常请假，
0000000000000,麻央,友達もあんまりできなくて、\nひとりで遊ぶことが多かったかな。,朋友也不多\n经常自己玩。
0000000000000,麻央,そのかわり、お仕事の現場で、\nよく遊んでいましたけどね。,不过在片场\n倒是经常玩耍呢。
0000000000000,{user},……なるほど。,……原来如此。
0000000000000,麻央,……って、プロデューサー、\nなにをメモしてるんですか？,……等等制作人\n你在记什么笔记啊？
0000000000000,{user},麻央さんの子供時代の思い出が、\nプロデュースのヒントになるかと。,麻央的童年回忆\n可能成为培育的灵感。
0000000000000,{user},とても興味深い。\nもっと話してください。,非常有意思\n请再多说些。
0000000000000,麻央,ええっ！？　ボ、ボクばっかり、　\n恥ずかしいですよ……,诶！？老、老让我说\n太羞人了……
0000000000000,麻央,プロデューサーの子供の頃の\n話も聴かせてください。,也想听听制作人\n小时候的故事呢。
info,adv_cidol-amao-3-009_02.txt,,
译者,Pro/deepseek-ai/DeepSeek-V3,,
