id,name,text,trans
0000000000000,{user},清夏さんの意見を歌詞に反映しました。\nこれでどうでしょうか？,我把清夏的意见反映到歌词里了。\n这样感觉如何？
0000000000000,清夏,良い感じ、だと思うけど……,我觉得还不错啦……
0000000000000,{user},なぜそんなに不安そうな顔を？,为什么看起来这么不安呢？
0000000000000,清夏,だ、だって……あたし、\n出しゃばりすぎてないかな……？,因、因为……我是不是\n太自作主张了……？
0000000000000,清夏,歌詞に、いろいろ言っちゃったし……\nなんなら結構あたしが書いてるし……,对歌词提了好多意见……\n甚至大部分都是我在写……
0000000000000,{user},大丈夫ですよ。\n作詞家さんも楽しそうでした。,没关系的。\n作词老师也觉得很开心呢。
0000000000000,清夏,そ、それならいいけど……,这、这样就好……
0000000000000,{user},すべては良い曲にするためです。,一切都是为了创作出好歌曲。
0000000000000,{user},ちゃんと良い曲になったかどうかは、\n清夏さんが判断してください。,最终效果好不好，\n就由清夏你来判断吧。
0000000000000,清夏,うん、聞いてみるね！,嗯，我现在就听听看！
0000000000000,清夏,う、うわ～、ヤバい！\nすっごく好きな曲になったんだけど！,呜哇～太棒了！\n变成我超级喜欢的歌了！
0000000000000,清夏,なんていうか……\n心から歌いたいって、そう思える。,该怎么说呢……\n让人发自内心想歌唱的感觉。
0000000000000,{user},ファンが清夏さんに抱くイメージからは\n離れた曲になっています。,这首歌与粉丝对清夏抱有的印象\n有所偏离。
0000000000000,{user},ですが、それは清夏さんの本音です。\n真に迫って歌えるはず。,但这就是清夏真实的心声。\n一定能唱出真情实感。
0000000000000,清夏,説得力を出せってことでしょ？\n任せてよ！,就是要表现出说服力对吧？\n包在我身上！
0000000000000,{user},その曲を聞いたファンは、もっと\n清夏さんを知りたいと思うでしょう。,听过这首歌的粉丝，\n一定会更想了解真实的清夏。
0000000000000,{user},ですが――,但是——
0000000000000,清夏,ファンの前では、嘘をつき続ける。\n……そうだよね？,在粉丝面前，要继续保持伪装。\n……是这样吧？
0000000000000,{user},はい。本当の清夏さんを伝えるのは、\n曲だけです。,是的。只有通过歌曲\n才能传达真实的清夏。
0000000000000,{user},ファンの前では、これからもずっと\n最強のアイドルでいてください。,请在粉丝面前永远保持\n最强偶像的形象。
0000000000000,清夏,Pっちの言っていること、難しいけど、\nなんとなく分かってきたよ。,P亲你说的话虽然很难懂，\n但我好像有点明白了。
0000000000000,清夏,要はさ、<em\=>色気</em>を出せってことだよね。,简单来说，就是要展现出性感对吧？
0000000000000,{user},良い表現ですね。,很到位的理解。
0000000000000,清夏,へへっ、そうでしょ？\nあたしなりに解釈してみたんだ♪,嘿嘿，对吧？\n这是我自己的理解方式♪
0000000000000,{user},清夏さんならきっと、\n色気ムンムンのアイドルになれます。,清夏一定能成为\n魅力四射的偶像。
0000000000000,清夏,……なんか嫌なんだけどその表現。,……这种说法好讨厌。
0000000000000,清夏,――もし素直になれたなら\n受け止めて。,——如果我能坦诚面对的话\n请接受这样的我。
0000000000000,清夏,いつか本当の「私」を　ねえ――,总有一天会展示真实的“我”——
0000000000000,清夏,……なんてね。,……开玩笑啦。
0000000000000,{user},はい、録音終了です。\nお疲れ様でした。,好的，录音结束。\n辛苦了。
0000000000000,{user},よかったんですか。\n最後、アドリブでしたが。,最后那段即兴发挥\n很不错呢。
0000000000000,清夏,Pっちはどう思った？,P亲觉得怎么样？
0000000000000,{user},……とても良いと思いました。,……我觉得非常棒。
0000000000000,清夏,じゃあきっと、これで良いんだよ。\nあたしの、精一杯の強がり。,那就一定没问题。\n这是我竭尽全力的逞强。
0000000000000,清夏,その方が、あたしらしいっしょ？,这样才更像我对吧？
0000000000000,{user},では、歌詞の改変に合わせて、\n曲も少し調整しますね。,那么根据歌词修改，\n曲子也要稍作调整。
0000000000000,清夏,え。つまり……録り直しってコト？,诶？意思是……要重录？
0000000000000,{user},当然でしょう。\n清夏さんの意見を反映するためです。,当然了。\n为了体现清夏的意见。
0000000000000,清夏,あ、あたし、今めっちゃイイ感じに\n歌えたと思うんだけどな～？,可、可我觉得刚才\n唱得超完美的说～？
0000000000000,{user},後日、また良い感じに歌ってください。\nよろしくお願いします。,改天请再唱出完美的感觉。\n拜托了。
0000000000000,清夏,そ、そんなぁ～！？,怎、怎么这样～！？
info,adv_cidol-ssmk-3-002_03.txt,,
译者,Pro/deepseek-ai/DeepSeek-V3,,
