id,name,text,trans
0000000000000,星南,……あら、プロデューサー。,……哎呀，制作人。
0000000000000,星南,ようこそ、生徒会室へ。,欢迎来到学生会室。
0000000000000,星南,今日は休日のはずだけど……\nなにか私に用かしら？,今天应该是休息日才对……\n是专程来找我的吗？
0000000000000,{user},星南さんが、浮かない顔を\nしているのを見かけたもので。,因为看到星南小姐\n似乎心事重重的样子。
0000000000000,{user},夢を叶えた翌日なのに、\nどうしたのかと気になりまして。,明明刚实现梦想第二天，\n有些在意你怎么了。
0000000000000,星南,……フフ、本当に、よく見ているわね。\n気付いたのは、あなたが最初よ。,……呵呵，你真是观察入微呢。\n第一个察觉到的人就是你。
0000000000000,星南,……実は、ライブの最後にした、\nあの発言……,……其实是在演唱会最后\n说的那段话……
0000000000000,星南,この私を――\n『一番星』を目指しなさい！！！,要以这个我——\n『一番星』为目标！！！
0000000000000,星南,アイドルの頂点は――\nあなたたちの夢は、ここにある！,偶像的顶点就在——\n你们的梦想，就在这里！
0000000000000,星南,私のファンたちが……\nとても喜んでくれているようなの。,我的粉丝们好像……\n都表现得特别激动。
0000000000000,{user},……あれはもう、熱狂していると\n言ってもいいくらいでしょうね。,……那已经可以说是\n近乎狂热了吧。
0000000000000,{user},昨日のライブには、\nあなたが心から発した言葉には、,昨晚演唱会上\n你发自内心的那番话，
0000000000000,{user},それだけの力があった。,确实拥有这样的力量。
0000000000000,星南,ええ……ふふっ……嬉しいわ。,嗯……呵呵……真让人开心。
0000000000000,星南,ただ……羽目を外し\nすぎている人もいるようで、,只是……有些粉丝\n好像兴奋过头了，
0000000000000,星南,昨日集まってくださった、伝説の\nアイドルの皆様。そのファンたちと……,和昨天到场的传说级\n偶像们的粉丝们在网上……
0000000000000,星南,ネットで大喧嘩しているのよ～～～！,吵得不可开交呢～～～！
0000000000000,星南,『どうだぁ見たか貴様らぁ！』,『怎么样啊看到了吗你们这群人！』
0000000000000,星南,『十王星南こそが真のトップアイドル\nだと思い知ったか～！』って！,『现在知道十王星南才是\n真正的顶级偶像了吧～！』
0000000000000,{user},……そのようですね。把握しています。,……情况我了解了。
0000000000000,星南,プロデューサー、私、ど、ど、\nどうしたらいいかしら……！,制作人，我、我该\n怎么办才好啊……！
0000000000000,星南,私の大切なファンたちが、\n目上の方々に大変な失礼を……！,我重要的粉丝们\n对前辈们太失礼了……！
0000000000000,{user},このくらいなら放置しても、\n大事にはならないと思いますよ。,这种程度放着不管\n也不会闹大的。
0000000000000,{user},安心してください。大事になっても、\nそのときはなんとかしますから。,请放心。就算真出问题\n到时候我也会想办法的。
0000000000000,星南,――――頼りになるわねあなた……！,————你真可靠啊……！
0000000000000,星南,私、プロデューサーになったとき、\nあなたみたいにやれる気がしないわ。,等我当上制作人的时候\n肯定做不到像你这样。
0000000000000,{user},プロデューサーとしては、\n先輩ですから。,毕竟作为制作人\n我是你的前辈。
0000000000000,{user},まだまだ後輩には負けられません。,可不能输给后辈呢。
0000000000000,星南,いつか……追いついてみせるわ。,总有一天……我会追上你的。
0000000000000,{user},聞くまでもないことですが、\nプロデューサーになるという目標は――,虽然不问也知道\n但你想成为制作人的目标——
0000000000000,星南,もちろん、いまも変わらないわ。\nだいぶ……先の話にはなったけれど。,当然，至今没有改变。\n只是……要实现的期限推迟了。
0000000000000,{user},春とは大きく状況が\n変わったと思いますが。,和春天时相比\n情况已经大不相同了吧。
0000000000000,星南,それでもよ。,即便如此也无妨。
0000000000000,星南,私は夢を叶えて、\nトップアイドルになった。,我已经实现了梦想\n成为了顶级偶像。
0000000000000,星南,アイドルが憧れるに\n相応しい<r\=アイドル>偶像</r>になれたわ。,成为了值得\n其他偶像憧憬的对象。
0000000000000,星南,けれど……この輝きは、\nあくまでファンからもらったもの。,但是……这份光芒\n终究是粉丝们赋予的。
0000000000000,星南,私の……素の<r\=ステータス>能力値</r>は、依然として、,我真实的……能力值
0000000000000,星南,トップアイドルの基準を\n満たすものではないわ。,不符合顶级偶像的标准\n的。
0000000000000,星南,なのに知名度はさらに上がって、\n有名になって、これからは――,可知名度还在上升\n越来越出名，今后——
0000000000000,星南,最上位のアイドルたちと\n比較される日々が続く。,会被拿来和顶尖偶像们\n不断比较的日子将持续下去。
0000000000000,星南,ファン同士の対立、アンチの増加。\n巨大な期待が圧し掛かってきて――,粉丝间的对立，反对者增加。\n巨大的期待化作压力——
0000000000000,星南,夢を叶えたというのに、私の悩みは\n減るどころか深まるばかりよ。,明明实现了梦想\n我的烦恼却不减反增。
0000000000000,星南,だからこそ、ね。こう思うの。\nこんな経験をしてきた……,正因如此呢。我在想\n如果有经历过这些的……
0000000000000,星南,元トップアイドルの\nプロデューサーがいたら、,前顶级偶像\n来当制作人的话，
0000000000000,星南,あなたに負けないプロデューサーに\nなれるんじゃないか、って。,说不定能成为\n不输给你的制作人。
0000000000000,{user},――――――――――――,————————————
0000000000000,星南,珍しいわね。\nあなたが動揺するなんて。,真稀奇呢。\n你居然会动摇。
0000000000000,{user},……いまのは、どういう意味ですか？,……刚才那话是什么意思？
0000000000000,星南,フフ……わかってるくせに。\n私の口から言わせたいの？,呵呵……明明心知肚明。\n非要我说出口吗？
0000000000000,星南,仕方ないわね……一度だけよ？,真拿你没办法……就这一次哦？
0000000000000,星南,一番星のトップアイドル、\n十王星南を育てたあなたは――,培育出顶级偶像“最亮星辰”\n十王星南的你——
0000000000000,星南,プロデューサーとしての……\n私の憧れで、夢で、目標なの。,正是作为制作人的……\n我的憧憬、梦想与目标。
0000000000000,星南,あなたのそばで、\nあなたに育てられながら……,在你身边\n接受你培育的同时……
0000000000000,星南,あなたのすべてを学んでいくわ。,我会学习你的一切。
0000000000000,星南,だから、これからもよろしくね――,所以今后也请多指教——
0000000000000,星南,私の、トッププロデューサーさん。,我的，顶级制作人先生。
info,adv_dear_jsna_010.txt,,
译者,Pro/deepseek-ai/DeepSeek-V3,,
