id,name,text,trans
0000000000000,{user},さて、佑芽さん。\nここまでの総括をしましょう。,那么，佑芽小姐。\n我们来总结一下到目前为止的情况吧。
0000000000000,佑芽,お願いします！,好的！
0000000000000,{user},一般的なアイドルを\n基準として考えると……,如果以普通偶像的\n标准来衡量的话……
0000000000000,{user},今回の結果は、\nまずまずといったところです。,这次的结果，\n只能说还算过得去。
0000000000000,佑芽,ふむふむ……,嗯嗯……
0000000000000,佑芽,あの、プロデューサーさん？\nいまの言い方だと……,那个，制作人先生？\n您刚才的说法……
0000000000000,佑芽,あたし、一般的なアイドル\nじゃない感じですか？,听起来像是在说，\n我不是普通偶像的感觉？
0000000000000,{user},じゃない感じですね。\n実に不可解な結果です。,确实不是呢。\n这结果实在令人费解。
0000000000000,佑芽,不可解！？　\nど、どういうことですか！？,费解！？\n这、这是什么意思！？
0000000000000,{user},今回、佑芽さんは――――,这次佑芽小姐你————
select,,大きく\n成長しました,取得了\n巨大的成长
select,,見違える\nようでした,简直判若\n两人
0000000000000,佑芽,おお～～！　\nそれっていいことですよね！？,哇啊～！\n这是好事对吧！？
0000000000000,{user},それはもちろん。しかし、\nこれはあまりにも……,那当然。但是，\n这也未免太……
0000000000000,佑芽,ふ、不穏な顔しないでください！,请、请不要露出这么不安的表情！
0000000000000,{user},ついこの間まで、\n素人同然だったはずなのに……,明明前不久\n还完全是个外行人……
0000000000000,{user},いまやアイドルとして、問題なく\nステージに立てるレベルです。,现在却已经达到能毫无问题地\n站上舞台的偶像水准了。
0000000000000,佑芽,あのあのっ……すごく褒めてるのに、\nどうして悩まし気な顔を？,那个那个……虽然您是在夸我，\n但为什么看起来这么困扰呢？
0000000000000,{user},成長というのは、本来、\nもっとなだらかな傾斜を描くものです。,成长原本应该是\n更平缓的曲线才对。
0000000000000,{user},こんな……意味不明な急角度で\n伸びたりはしない。,这种……莫名其妙的陡峭角度\n根本不正常。
0000000000000,佑芽,それって、あたしがいつも\nお姉ちゃんに言いたいことですよ。,这话我经常\n想对姐姐说呢。
0000000000000,{user},いまの佑芽さんも、咲季さんに\n負けないほどおかしいです。,现在的佑芽小姐，\n奇怪程度已经不输给咲季小姐了。
0000000000000,佑芽,そっ……そう、\nなん、でしょうか……？,是、是这样\n吗……？
0000000000000,佑芽,だとしたら、それは……\nプロデューサーさんのおかげです。,如果真是这样的话……\n那都是制作人先生的功劳。
0000000000000,佑芽,朝起きたら、昨日までの自分とは\nなにかが違っている感覚。,早上醒来时，总觉得\n和昨天的自己有些不同。
0000000000000,佑芽,いままで何度やってもできなかった\nことが、急にできるようになる感覚。,以前怎么都做不到的事，\n突然就能做到的感觉。
0000000000000,佑芽,こんなに早くつかめたのは……\nはじめてですから。,能这么快掌握诀窍……\n还是第一次呢。
0000000000000,佑芽,プロデューサーさんっ！　\nですから……そのっ――,制作人先生！\n所以……那个——
0000000000000,佑芽,ぜひこれからも！　\nよろしく！　お願いします！！,今后也请您！\n多多关照了！！
info,adv_pstory_001_hume_ending-normal-02.txt,,
译者,Pro/deepseek-ai/DeepSeek-V3,,
