id,name,text,trans
0000000000000,咲季,ふうっ！　\nどうかしら、プロデューサー？,呼！\n怎么样，制作人？
0000000000000,{user},咲季さんのやりたいことが\n見えてきました。,看到咲季小姐想做的事情了。
0000000000000,{user},最近の体験で得た新たな手札を、\nさっそく活用しているようですね。,似乎正在马上活用从最近经历中获得的新手牌呢。
0000000000000,咲季,ふふっ、お見通しね。,呵呵，被看穿了呢。
0000000000000,咲季,ダイレクトに参考になったのは、\n広たちと行ったライブよ。,直接成为参考的，\n是和广他们一起去的演唱会。
0000000000000,咲季,『ガラクタロード』を直接聴いてみて、\nとても拡張性の高い楽曲だと思ったの。,直接听了《GARAKUTA ROAD》后，\n觉得那首曲子扩展性非常高呢。
0000000000000,咲季,あそこまでキュートに歌って\nいいんだって、驚いた。,竟然可以唱得那么可爱，\n我很吃惊。
0000000000000,咲季,100プロのアイドルひとりひとりが、\n自分だけの『ガラクタロード』を\n歌っている。,100Pro的每一位偶像，\n都在唱着自己独有的《GARAKUTA ROAD》。
0000000000000,咲季,それならわたしは、花海咲季の\n『ガラクタロード』を歌う。,那么我，就唱花海咲季的\n《GARAKUTA ROAD》。
0000000000000,咲季,わたしの人生を込めて、\nわたしだけの武器を創り上げるわ。,倾注我的人生，\n打造只属于我的武器。
0000000000000,{user},聴いていて、優しく励まされている\nように感じました。,听的时候，\n感觉被温柔地鼓励了。
0000000000000,咲季,それは……\nあなたがわたしにくれた手札よ。,那是……\n你给我的手牌。
0000000000000,{user},心から歌を楽しんでいることが\n伝わってきました。,从心底享受歌唱这件事\n传达给我了。
0000000000000,咲季,とあるゲームを、はじめてプレイした\nときの気持ちを込めたの。,融入了第一次玩某款游戏时的心情。
0000000000000,{user},アグレッシブに攻め立てるような一幕も\nありました。,也有过像积极进攻般的一幕。
0000000000000,咲季,とあるレジェンドプレイヤーに師事して\n『ザ・クイーン・オブ・あにまるズ』の\n修行をした経験が生きたわね。,师从某位传奇玩家，\n进行《THE QUEEN OF ANIMALS》的\n修行经验用上了呢。
0000000000000,咲季,それらは……ゲームを作った方々や、\n同じゲームをプレイしたユーザーたち\nからいただいた手札。,那些是……从游戏制作的人们，\n和玩同样游戏的用户们\n那里得到的手牌。
0000000000000,咲季,星南が言っていたわ。花海咲季は、\n手札の多さが武器になるって。,星南说过，花海咲季\n手牌多是武器。
0000000000000,咲季,こういう使い方で……\nよかったのかしら。,这样的用法……\n可以吗。
0000000000000,{user},非常に人気の高い『デッキビルダー』\nというゲームジャンルがあります。,有一种非常受欢迎的\n叫《牌组构筑者》的游戏类型。
0000000000000,{user},プレイ中に獲得した手札を、効果的に\n組み合わせて、強力な山札を構築する。,将游戏中获得的手牌，有效地\n组合起来，构筑强大的牌组。
0000000000000,咲季,わたしみたいなゲームね！,就像我一样的游戏呢！
0000000000000,{user},あらためて……そう思います。,再次……我这么觉得。
0000000000000,{user},あなたが積み重ねてきた数多の経験が、\nいま……無数の手札となって、\n花海咲季を輝かせている。,你积累起来的无数经验，\n现在……变成了无数的手牌，\n让花海咲季绽放光彩。
0000000000000,咲季,逃げ続けてきた人生だと思っていたけど\n……捨てたものじゃなかったのかしら。,我一直以为是不断逃避的人生，\n但……也许不是白费的。
0000000000000,{user},あなたの人生に、\nなにひとつ寄り道などなかった。,你的人生里，\n没有任何一步是绕远路的。
0000000000000,咲季,あなたがそうしたのよ。,是你让它变成这样的。
0000000000000,咲季,佑芽はわたしに最強の切り札を\nくれたけど……,佑芽给了我最强的王牌，\n但是……
0000000000000,咲季,あなたは、わたしが集めてきたすべての\nカードを信じてくれた。,你相信了我收集起来的\n所有卡片。
0000000000000,咲季,だったら……\nあなたの信頼に応えなくちゃ！,那么……\n必须回应你的信赖才行！
0000000000000,咲季,張り切って強力な山札を作りましょう！\nオリジナルデッキの名前は――,干劲十足地来制作强大的牌组吧！\n原创牌组的名字是——
0000000000000,咲季,トップアイドル・花海咲季よ！！,顶级偶像·花海咲季哦！！
info,adv_cidol-hski-3-018_03.txt,,
译者,deepseek-v4-pro,,
