id,name,text,trans
0000000000000,あさり先生,篠澤さんの目下の課題は\n体力不足だと伺っています。,我听说筱泽同学目前最大的问题\n就是体力不足。
0000000000000,広,そう、体力不足。,嗯，体力不足。
0000000000000,あさり先生,しかし体力がつくのを待っていたら\n卒業、なんてことになりかねません。,但如果等到体力练好再行动\n说不定都要毕业了。
0000000000000,あさり先生,デビューを目指すなら、どうしても\nどこかで一歩踏み出す必要があります。,既然以出道为目标\n无论如何都必须迈出第一步才行。
0000000000000,あさり先生,そんなとき、体力不足を\nどうやって補えばいいと思いますか？,这种情况下你觉得\n该怎么弥补体力不足的问题呢？
0000000000000,広,……プロデューサー。\nなにか考えてる？,……制作人。\n你有什么想法吗？
0000000000000,{user},（なかなか痛いところをついてくる）,（真是直击痛处啊）
select,,体力のいらない\n仕事を,选择不需要\n体力的工作
select,,実践で鍛える,通过实战\n来锻炼
select,,体力不足を\nウリにする,把体力不足\n当作卖点
0000000000000,{user},選択肢は減りますが、現実的に\n考えるならこれでしょう。,虽然选择范围会变小\n但现实考虑的话应该是这个吧。
0000000000000,広,どういう仕事？,具体是什么工作？
0000000000000,{user},座って話したり、\nスポットでの出演だったり。,比如坐着聊天\n或者参加定点演出之类的。
0000000000000,広,ふふ……耐えられるかな。,呵呵……我能坚持住吗？
0000000000000,{user},その心配がなくなるくらいには\n鍛えてもらいますよ。,我会让你锻炼到\n完全不用担心这个的程度。
0000000000000,あさり先生,そうですね、現場を見極めるのも\nプロデューサーの仕事です。,确实呢，准确判断现场情况\n也是制作人的职责所在。
0000000000000,あさり先生,新人では大変でしょうが、\nきっとうまくできますよ♪,对新人来说可能很辛苦\n但你一定能做好的♪
0000000000000,{user},体力づくりのビジョンには\n実践での体力向上も含まれています。,体能提升计划中\n本来就包含实战锻炼环节。
0000000000000,{user},篠澤さんがやり遂げられるラインを\n見極めることに全力を注ぎます。,我会全力把握\n筱泽同学能够完成的任务界限。
0000000000000,あさり先生,な、なかなか綱渡りですね……,这、这可真是走钢丝啊……
0000000000000,広,プロデューサーができると\n思うなら……,既然制作人\n觉得可行的话……
0000000000000,広,文句、言わないよ。,我不会有怨言。
0000000000000,あさり先生,なるほど。\n信頼関係の賜物、ですね。,原来如此。\n这就是相互信任的证明呢。
0000000000000,{user},みんなが踊っているなか、\n棒立ちというのもネタになります。,在大家都在跳舞时站着不动\n说不定也能成为话题。
0000000000000,{user},もちろんそれでは長続きしないので、\n一時しのぎですが。,当然这只是权宜之计\n不能长久这么干。
0000000000000,広,プロデューサー、いろんなこと\n考えてるんだね。,制作人考虑得\n真周到啊。
0000000000000,広,そんなの、思いつかなかった。,我就完全没想到这些。
0000000000000,{user},考えるのがプロデューサーの\n仕事ですから。,因为思考这些\n就是制作人的工作啊。
0000000000000,あさり先生,棒立ちは確かにかなり変わった\nアイデアかもしれませんが……,站着不动确实是个相当\n与众不同的点子……
0000000000000,あさり先生,いろんな案を持ってるのは、\n敏腕の証、ですね♪,能想出这么多方案\n正是实力派的证明呢♪
info,adv_pevent_001_shro_school_003.txt,,
译者,Pro/deepseek-ai/DeepSeek-V3,,
