id,name,text,trans
0000000000000,ことね,わ～！　ほんとにもう\nイルミネーションやってる！,哇～！居然真的\n开始亮灯了呢！
0000000000000,{user},もうすこし進むと、\n有名なイルミネーションスポットが\n見えてきますよ。,再往前走一点，\n就能看到著名的\n灯光秀景点哦。
0000000000000,ことね,さっすがプロデューサー。\n下調べはばっちりですネ♪,不愧是制作人\n事前调查做得很充分嘛♪
0000000000000,ことね,あ！　あの先っぽだけ見えてるの、\nクリスマスツリーじゃないですか！？,啊！那边露出来的尖尖\n该不会是圣诞树吧！？
0000000000000,ことね,早くそばまで行きましょうよ～。,我们快点过去啦～
0000000000000,{user},そう慌てず、\n先に練習をしておきませんか？,先别着急\n要不要做些事前练习呢？
0000000000000,ことね,なんのです？,要练什么呀？
0000000000000,{user},トップアイドルになったとき、\nお忍びで出かける練習です。,成为顶级偶像后\n微服出行的特训。
0000000000000,ことね,お忍びの練習って言われても……\nぴんとこないんですケド。,突然说什么微服练习……\n完全没概念啦……
0000000000000,ことね,ん～、変装とか？,嗯～要变装之类的吗？
0000000000000,{user},いいですね。藤田さんにどんな変装が\n似合うのか、色々試してみましょう。,不错呢。来试试看\n什么样的装扮适合藤田同学吧。
0000000000000,ことね,いや～、ついついテンション上がり\nすぎちゃいました～♪,哎呀～不知不觉\n就兴奋起来啦～♪
0000000000000,ことね,どのお忍びコーデが、\n一番あたしに似合ってましたか？,哪种变装造型\n最适合我呢？
0000000000000,{user},金色のファーコートと特大サングラスの\nコーディネイトが一番でした。,金色皮草大衣配超大墨镜\n的搭配最惊艳。
0000000000000,ことね,それあたしがふざけて選んだやつ～！\nイヤ着てて気分よかったですけども。,那是我开玩笑选的啦！\n虽然穿起来确实超带感的～
0000000000000,{user},似合いすぎて、\n仕事で使えるレベルでした。,合适到可以直接\n用在工作中呢。
0000000000000,ことね,帽子を色々合わせようとしてたのって、\nまさかそういう意図で……！？,原来你让我试戴那么多帽子\n打的是这个主意……！？
0000000000000,ことね,あ！　前もって言っておきますけど、,啊！先说好哦
0000000000000,ことね,あたしにプレゼントとか\n買っちゃだめですよー。,不许给我买\n什么礼物啦～
0000000000000,ことね,夜景の見えるレストランとかも、\nその……今回は、だめーです。,能看到夜景的餐厅什么的\n这次……也绝对不行！
0000000000000,ことね,これはあくまでクリスマスデートの\n練習なので。,因为这次只是\n圣诞约会的练习嘛
0000000000000,ことね,たくさんお金を使うのは……\nNGですからネ♪,乱花钱什么的……\n是禁止事项哦♪
0000000000000,{user},そういうと思いました。藤田さんの\n性格は、よくわかっていますよ。,早就猜到你会这么说\n我很了解藤田同学的性格呢
0000000000000,ことね,ならいーです。\nさ、今度こそツリー見にいきましょう！,这还差不多\n快去看圣诞树吧！
0000000000000,ことね,あ～、楽しかったぁ！,啊～今天真开心！
0000000000000,ことね,ありがとうございます、\nプロデューサー。,谢谢你\n制作人
0000000000000,{user},『普通のクリスマス』と呼ぶには、\nささやかでしたが。,虽然说是体验“普通圣诞节”，\n也有点太朴素了。
0000000000000,{user},クリスマス気分には、なれましたか？,有感受到圣诞气氛吗？
0000000000000,ことね,ばっちりです！,超级完美！
0000000000000,ことね,これならクリスマスライブ、\nイイ感じにできそーですっ。,这样圣诞演唱会\n肯定能表现超棒～
0000000000000,ことね,ファンの皆さんのクリスマスを、\n思いっきり盛り上げてみせます！,我要让所有粉丝\n都度过最嗨的圣诞节！
0000000000000,{user},そうしたら、また人気が上がって\n大儲けできますね。,那样人气又会上升\n赚大钱了呢
0000000000000,ことね,はい！　目指せ大金持ち！　ですから！,没错！目标成为大富豪！就是这样！
0000000000000,{user},藤田さん。初星学園のあるこの天川は、\nアイドルに理解のある土地です。,藤田同学。初星学园所在的天川市\n是对偶像很包容的城市
0000000000000,{user},プロデューサーとアイドルが、\nこうして並んで歩いていようと、,就算制作人和偶像\n像这样并肩而行
0000000000000,{user},なんの問題にもなりません。\nですが……,也不会引起什么问题\n但是……
0000000000000,ことね,……わかってますよ。\n練習なんて言いましたけど。,……我明白的\n虽然说是练习
0000000000000,ことね,あたしの夢に近づいたら、\n本番なんてもう来ないのかも。,但等我实现梦想后\n可能就再没这种机会了
0000000000000,ことね,普通のイベントなんて、\n夢のまた夢になって――,普通的约会活动\n都会变成奢望——
0000000000000,ことね,――そんなの、\nとっくに覚悟してますけどね。,——这种事\n我早就做好觉悟了
0000000000000,ことね,これでもアイドル、4年目なので。\nアイドルの義務くらい、わかってます。,毕竟我也当了四年偶像\n该懂的规矩都懂啦
0000000000000,{user},……そのわりに、脇が甘い。,……但防备心还是太弱
0000000000000,ことね,うぐっ……言い返せない。,呜……无法反驳
0000000000000,ことね,――白状しちゃいますけど。,——老实说吧
0000000000000,ことね,あんまり心配してないんです、色々。,其实我并不是很担心这些
0000000000000,ことね,アイドルの義務をしっかり果たして……\nだけど、ふつーにイベントを楽しんで。,既要履行偶像的职责……\n又想享受普通约会……
0000000000000,ことね,そんなの絶対無理なんですけど……,虽然知道根本不可能……
0000000000000,ことね,プロデューサーと一緒なら、\nきっとなんとかなりますって。,但只要是和制作人一起\n总觉得会有办法的
0000000000000,{user},なんとかしますよ、なにがあろうと。\nさしあたっては、これをどうぞ。,当然会有办法，无论如何\n先收下这个吧
0000000000000,ことね,……プレゼント。練習でお金を\n使っちゃダメって言いましたよね？,……礼物？不是说练习时\n不许乱花钱吗？
0000000000000,{user},買ったものではありません。\n開けてみてください。,不是买的\n打开看看吧
0000000000000,ことね,毛糸の帽子……手編み！？　\nプロデューサーの！？,毛线帽……手织的！？\n制作人织的！？
0000000000000,{user},ライブまで風邪などひかぬように、\n気を付けてください。,演唱会前请注意保暖\n别感冒了
0000000000000,ことね,はーい。……ったく……ったくぅ……\n可愛い帽子じゃんか～。,知道啦……真是的……\n这帽子也太可爱了吧～
0000000000000,ことね,あー、ほんっと。あたしの\nプロデューサーは、<em>わかって</em>ますね～。,啊～真是的\n我的制作人
0000000000000,ことね,このお返しは、\n<em>本番</em>のときにしちゃうんで――,这份回礼\n要等到正式约会时——
0000000000000,ことね,期待しててくださいっ！,敬请期待哦！
info,adv_cidol-fktn-3-006_03.txt,,
译者,Pro/deepseek-ai/DeepSeek-V3,,
