id,name,text,trans
0000000000000,{user},（姫崎さんの様子を見に行こう……）,（去看看姬崎的情况吧……）
0000000000000,莉波,ワン、ツー、ワン、ツー……っと、\nここでフィニッシュ！,一、二、一、二……\n在这里收尾！
0000000000000,莉波,うん、まあまあ……かな！,嗯，还算可以……吧！
0000000000000,{user},頑張っていますね。,很努力呢。
0000000000000,莉波,あ、{user}くん。\n……今のどうだった？,啊，{user}君。\n……刚才的表演怎么样？
select,,もう少し表情を\n意識しましょう,可以多注意一下\n表情管理
select,,根を詰めすぎかも\nしれません,可能是有点\n太拼了
select,,ステップを\n変えてみましょう,试着调整一下\n舞步吧
0000000000000,{user},アイドルにとって、\n表情はなにより大切な要素です。,对偶像来说，\n表情是最重要的要素。
0000000000000,莉波,そうだよね、みんなを笑顔にするには、\n私が笑顔を見せないとね。,说得对呢，要让观众露出笑容，\n我自己得先保持笑容才行。
0000000000000,莉波,ただ、難しいステップのところだと、\nいっぱいいっぱいになっちゃって……,不过遇到复杂的舞步时，\n就会手忙脚乱……
0000000000000,{user},まずは身体がステップを覚えるまで、\nしっかり練習しましょう。,首先要让身体记住舞步，\n扎实地练习吧。
0000000000000,莉波,うん、そうだね！\nがんばるよ！,嗯，没错！\n我会加油的！
0000000000000,{user},調子はいいようですが、\n適度に休憩もとってください。,状态看起来不错，\n但也要适当休息哦。
0000000000000,莉波,うん、ありがとう。\nでも、もっと頑張らないと……,嗯，谢谢。\n但我必须更加努力……
0000000000000,莉波,私はもう3年生だし、これが、\n最後のチャンスかもしれないから……,毕竟我已经三年级了，这次可能是\n最后的机会了……
0000000000000,{user},焦る気持ちはわかりますが、自分を\n追い込みすぎないでください。,我理解你着急的心情，\n但别把自己逼太紧。
0000000000000,{user},無理をして、怪我をしては\n元も子もありませんから。,如果勉强受伤的话，\n就得不偿失了。
0000000000000,莉波,……うん、気をつけるようにするよ。\nありがとう、{user}くん。,……嗯，我会注意的。\n谢谢你，{user}君。
0000000000000,莉波,……え、ステップを？,……咦，舞步吗？
0000000000000,{user},全体的にいい感じの\nパフォーマンスでしたが、,整体上感觉不错的\n表演呢，
0000000000000,{user},決めポーズの前のステップは、\n少し足首に負担が大きいかと。,不过收尾动作前的舞步\n可能对脚踝负担有点大。
0000000000000,莉波,あ、たしかに、ちょっと\n足がもつれるときがあるかも。,啊，确实有时候\n会觉得脚步不稳。
0000000000000,{user},ステップを簡略化して、めりはりを\nつけたほうがよくなると思います。,建议简化舞步，\n增强节奏感会更好。
0000000000000,{user},たとえば、ここのステップをこう、\nこうしてみるのは……,比如这里的舞步可以\n这样调整……
0000000000000,莉波,あ、なるほど……\nそれなら、たしかに……うんうん……,啊，原来如此……\n这样的话确实……嗯嗯……
0000000000000,莉波,ワン、ツー、フィニッシュ！,一、二、收尾！
0000000000000,莉波,本当だ。こっちのほうが、\n最後のポーズが決まるよ！,真的耶。这样改之后\n最后的pose更稳了！
0000000000000,{user},お役にたててよかったです。,能帮上忙真是太好了。
0000000000000,莉波,ふふっ、さすがだね。\nありがとう、{user}くん。,嘿嘿，果然厉害呢。\n谢谢你，{user}君。
info,adv_pstory_001_hrnm_after-step-2-normal-02.txt,,
译者,Pro/deepseek-ai/DeepSeek-V3,,
