id,name,text,trans
0000000000000,{user},プロデュースも一区切りしましたので、\nここまでの総括をしたいと思います。,偶像育成工作告一段落了，\n我想来做个阶段性总结。
0000000000000,広,うん。,嗯。
0000000000000,{user},まずは、自己評価をお願いします。,首先请做一下自我评价吧。
0000000000000,広,今回のプロデュース。\nわたしの自己評価は……,这次的偶像培育工作。\n我的自我评价是……
0000000000000,広,大成功だったと思う！,我觉得是大成功！
0000000000000,{user},どのあたりが、でしょう？,具体体现在哪些方面呢？
0000000000000,広,模擬演習をして、無事に\n生きて帰ってきたところ。,完成了模拟演出训练，\n还能平安活着回来这点。
0000000000000,{user},……なるほど。,……原来如此。
select,,確かに……\n良い結果でしたね,确实……\n算是好结果呢
select,,目標が\n低すぎませんか？,这个目标\n是不是定得太低了？
0000000000000,広,ふくみがありそうな顔。いいね。,你这表情很有深意嘛。不错。
0000000000000,{user},いえ、実際、\n良い結果だったと思いますよ。,不，实际上\n我觉得确实是好结果。
0000000000000,{user},篠澤さんは、想定以上に\n頑張ってくれました。,篠泽小姐的表现\n超出了预期呢。
0000000000000,広,だって……\nすぐにプロデューサーが……,因为……\n制作人你当时……
0000000000000,広,わたしを見限りそうな目で、\nわたしを見るから。,用那种马上要放弃我的眼神\n盯着我看啊。
0000000000000,広,必死だった。,我只能拼命了。
0000000000000,広,そうでもない。,其实也没那么夸张。
0000000000000,広,ちょっと前まで、\nわたしはもっとひどかった。,就在不久前，\n我表现得比现在糟糕多了。
0000000000000,広,歌いながら踊ったりしたら、\n倒れちゃうのが当たり前だった。,边唱边跳的话，\n晕倒都是家常便饭。
0000000000000,広,プロデューサーのおかげで、\n成長できた。,多亏了制作人，\n我才能有所成长。
0000000000000,広,だから、大成功。,所以说，是大成功。
0000000000000,{user},……やれやれ。,……真拿你没办法。
0000000000000,{user},今後も、歯ごたえのある\nプロデュースになりそうです。,看来今后的偶像培育工作\n也会充满挑战呢。
0000000000000,広,わたしも、そう思う。,我也这么觉得。
0000000000000,広,そうなったら、いいな。,希望能保持这样。
0000000000000,広,プロデューサー。,制作人。
0000000000000,広,これからも、よろしく。,今后也请多指教了。
info,adv_pstory_001_shro_ending-normal-04.txt,,
译者,Pro/deepseek-ai/DeepSeek-V3,,
