id,name,text,trans
0000000000000,星南,あら、プロデューサー。,啊，制作人。
0000000000000,星南,……私のレッスン、見ていた？,……你一直在看我的训练吗？
0000000000000,{user},はい、最初から最後まで。\n余すところなく。,是的，从头到尾。\n一点都没落下。
0000000000000,星南,そう。感想をお願い。,这样啊。说说你的感想吧。
select,,いままでとは違う,感觉和以前不一样了
select,,変わったようには\n見えません,看起来好像\n没什么变化
select,,可愛く見えました,看起来更可爱了
0000000000000,{user},そう見えました。,看起来确实不一样了。
0000000000000,星南,そう……よね？　いままでにない\n手応えがあった、ような、気が、して。,对吧……？我感觉好像\n抓到了些前所未有的手感……
0000000000000,星南,具体的にどこがどう違うのか……\nあなたにはわかった？,具体是哪里不一样呢……\n你看出来了吗？
0000000000000,{user},わかりません。,没看出来。
0000000000000,星南,ちょっと！　もう……,真是的！你这个人……
0000000000000,{user},撮影してありますから、\n手応えの正体を探しましょう。,我已经录下来了，\n我们一起来找找手感的变化吧。
0000000000000,星南,ええ……必ず見つけてみせる。\n成長のカギを……,嗯……我一定要找出来。\n找到成长的关键……
0000000000000,星南,……そう。気のせいだったのかしら。,……难道是我的错觉吗？
0000000000000,星南,いままでにない感覚があった……\nような気がしたのだけど。,刚才明明感觉到了\n从未有过的状态……
0000000000000,{user},動画を撮影してあります。いままでの\nものと見比べてみましょう。,我录了视频。和之前的\n对比看看吧。
0000000000000,星南,そうね……たとえわずかな変化でも……,好……就算是细微的变化……
0000000000000,星南,いまの私には、希望の光よ。,对现在的我来说也是希望之光。
0000000000000,星南,ええっ？　も、もう……,诶？等、等等……
0000000000000,星南,大事な話をしているのに、\nからかわないでくれるかしら？,我在说正经事的时候，\n能不能别捉弄我？
0000000000000,{user},真面目な意見です。,我是认真的。
0000000000000,星南,……そ、そう？,……真、真的吗？
0000000000000,星南,いま、わずかに……\nいままでにない手応えがあったの。,刚才确实有一点点……\n从未有过的感觉。
0000000000000,星南,あなたに言われたこと……\nよく考えてみるわ。,你说过的话……\n我会好好考虑的。
info,adv_pstory_001_jsna_after-step-1-normal-01.txt,,
译者,Pro/deepseek-ai/DeepSeek-V3,,
