id,name,text,trans
0000000000000,千奈,『NEXT IDOL AUDITION』！！　\n先生、わたくし存じておりますわっ！,『NEXT IDOL AUDITION』！！\n老师，我早就听说过这个比赛了！
0000000000000,千奈,学園の皆様が噂をしている、\nあの大会ですのね！,就是学校里大家都在讨论的\n那个大型赛事对吧！
0000000000000,{user},ええ、倉本さんの次の目標は『N.I.A』\n最終日に開催されるオーディション、,没错，仓本同学的下个目标是在『N.I.A』\n最终日举办的选拔赛——
0000000000000,{user},『FINALE』で\n優勝ライブをすることです。,在『FINALE』中\n赢得冠军演出机会。
0000000000000,千奈,えぇぇ～～っ！　せっ、先生ぇ……\nさすがに無謀なのでは……,诶诶～～！老、老师……\n这会不会太冒险了……
0000000000000,{user},倉本さんは当初の予定よりも\nずっと早く、ずっと強く、,仓本同学已经比原计划\n更早、更强地——
0000000000000,{user},立派なアイドルとして\nスタートを切りました。,作为优秀偶像\n踏出了第一步。
0000000000000,{user},決して無謀な挑戦などではありません。\n十分な勝機があります。,这绝非鲁莽的挑战。\n我们完全有获胜的机会。
0000000000000,千奈,ほ、本当ですの……？,真、真的吗……？
0000000000000,{user},もちろん。\nそれに、あとで説明しますが……,当然。\n而且稍后我会说明——
0000000000000,{user},『N.I.A』は我々にとって、\nとても有利な大会なんですよ。,『N.I.A』对我们来说\n是非常有利的赛事。
0000000000000,千奈,まぁ先生が……悪い笑顔を。\nうふふ……先生がおっしゃるのなら。,老师露出……坏心眼的笑容了呢。\n呵呵……既然老师这么说。
0000000000000,千奈,わたくし信じますわ！　\n倉本千奈に勝機はあると！,我愿意相信！\n仓本千奈确实有机会获胜！
0000000000000,千奈,たくさんたくさん\nファンの皆様から支持を得て……,我要争取获得\n更多更多粉丝的支持……
0000000000000,千奈,『FINALE』で、優勝を目指しますわっ！,以在『FINALE』夺冠为目标！
0000000000000,{user},いい意気込みです。調子よく\nステップアップをしていければ……,很有干劲呢。如果能顺利\n逐步提升的话……
0000000000000,{user},もしかすると……冬の『H.I.F』には、\n出場できるかもしれませんよ。,说不定……冬天的『H.I.F』\n也能参加哦。
0000000000000,千奈,うふふ、夢が膨らみますわぁ～！　\nさあ、まずはなにをいたしましょう！,呵呵，梦想越来越大了呢～！\n那么，我们首先该做什么呢！
select,,ファンクラブの設立を,先成立粉丝俱乐部
0000000000000,千奈,わたくしの……ファンクラブ！！　\nついにですのね！,我的……粉丝俱乐部！！\n终于要来了呢！
0000000000000,{user},ついに、というか。実は……\n倉本グループの皆様によって、,说是终于……其实……\n仓本集团的各位已经——
0000000000000,{user},非公式のファンクラブが\nすでに発足しています。,自发成立了\n非官方的粉丝俱乐部。
0000000000000,千奈,ええっ！？　わたくしなんにも\n聞いておりませんわ！,诶！？我完全\n没听说这件事啊！
0000000000000,{user},いつの間にかできていたんです。\n熱狂的な倉本千奈ファンによって……,不知不觉就成立了。\n都是狂热仓本千奈粉丝的手笔……
0000000000000,千奈,熱狂的なわたくしのファン……\nそんな方々がいらっしゃいますの？,狂热的……我的粉丝？\n真的有这样的人存在吗？
0000000000000,メイド,大旦那様、大奥様、旦那様、奥様、\nご親族や系列会社の役員の皆様方……,老爷大人、夫人大人、少爷大人、少奶奶大人、\n各位亲戚和关联公司的董事们……
0000000000000,千奈,ふぇ、ふぇぇぇぇぇぇ…………？\n一族の重鎮ばかりですわ～～～！,呜、呜哇哇哇哇哇…………？\n全是家族里的长辈啊～～～！
0000000000000,メイド,僭越ながらこの私も、会員No.9として、\nお嬢様との取次を担当しております。,恕我冒昧，作为9号会员的我\n也负责小姐的联络工作。
0000000000000,千奈,……香名江。あなたまで……,……香名江。连你也……
0000000000000,メイド,お嬢様のライブは、それだけ……\n素晴らしいものだったのです。,因为小姐的演出……实在是\n太过精彩了。
0000000000000,メイド,ご親族一同、家臣一同……皆、泣いて\nいました。ご立派になられた、と。,全族上下、所有家臣……都感动得哭了。\n说小姐终于出息了。
0000000000000,千奈,えぇ……も、もう……皆さまったら、\n身内びいきなのですから……,啊呀……真是的……大家\n都太护短了啦……
0000000000000,メイド,お嬢様の認可をいただければ、即座に\n公式ファンクラブとして発表を。,只要小姐许可，\n立刻就能转为官方粉丝俱乐部。
0000000000000,千奈,わたくしの知らないところで、大変な\nできごとが起こっていたようですわ。,看来在我不知道的地方\n发生了不得了的事呢。
0000000000000,メイド,一言号令をいただければ、\nお嬢様の御許に、,只要您一声令下，\n立刻就能——
0000000000000,メイド,出場条件を満たして余りあるファン投票\nが集まることでしょう。,为您募集到远超参赛条件\n所需的粉丝投票数。
0000000000000,千奈,そ、そそ、それは！　いけませんわ！,这、这样不行！
0000000000000,千奈,命じて好きになっていただくのでは、\nアイドルとはいえませんもの。,靠命令获得的喜欢，\n根本不能算是偶像。
0000000000000,千奈,先生はおっしゃいました。倉本の名や\n権威は……わたくしの才能だと。,老师说过。仓本之名\n与权势……就是我的才能。
0000000000000,千奈,わたくしと切り離すことはできない\nもので、だからこそ……,这是与我不可分割的部分，\n正因如此……
0000000000000,千奈,行使には責任が伴うのですわ。\n濫用するわけにはいかないのです。,行使权力必然伴随责任。\n绝不能滥用职权呢。
0000000000000,千奈,ファンクラブを認可しますわ。\nですけれど、ファンを増やすのは。,我批准成立粉丝俱乐部。\n不过要增加粉丝数量……
0000000000000,千奈,わたくし自身の、アイドル活動で。,还是要靠我自己的偶像活动。
0000000000000,千奈,まっとうな『アイドル活動』への\n支援は、ありがたくいただきますわ。,对于正规的『偶像活动』\n获得的支援，我衷心感谢。
0000000000000,メイド,仰せのままに、お嬢様。,谨遵您的吩咐，大小姐。
0000000000000,千奈,……ふぅ、びっくりしちゃいましたわ。,……呼，真是吓到我了。
0000000000000,{user},立派でしたよ。,表现得很出色。
0000000000000,千奈,えへへ……ありがとうございます先生。\nでも、わたくしね、改めて思うのです。,嘿嘿……谢谢您老师。\n但我重新思考过了……
0000000000000,千奈,わたくしの家柄は……本当に……\nずるいですわね、と。,我的家世背景……实在是……\n太占便宜了呢。
0000000000000,{user},繰り返しますが、立派な才能ですよ。\n後ろめたい気持ちがあるんですか？,再说一次，这是了不起的才能。\n你感到内疚吗？
0000000000000,千奈,いいえ、まったく！　\n責任を持って、我が道を進みますわ！,不，完全不会！\n我会肩负责任走自己的路！
0000000000000,{user},よろしい。では、改めて……\n倉本千奈の勝機について話しましょう。,很好。那么重新……\n来讨论仓本千奈的胜算吧。
0000000000000,千奈,はいっ！　先生は、\nこうおっしゃいました。,好的！老师\n这样说道。
0000000000000,千奈,『N.I.A』は、我々にとって\n有利な大会だと……何故なのでしょう？,『N.I.A』对于\n我们来说是个有利的大会……为何呢？
0000000000000,{user},公開オーディションの審査には、\n観客による投票が含まれるからです。,因为公开选拔评审包含\n观众投票环节。
0000000000000,千奈,うふふ……ちっともわかりませんわ。\n簡単におっしゃってくださいませ！,呵呵……完全不明白呢。\n请说得简单些！
0000000000000,{user},いままでの『試験』と比べて、プロ\nデューサーの力量が大きく問われます。,相比之前的『考试』，这次更考验\n制作人的能力。
0000000000000,{user},力を合わせてがんばりましょう。,让我们齐心协力加油吧。
0000000000000,千奈,わぁぁ～～～～っ！　それなら\nわたくし、優勝間違いなしですわ！,哇啊～～！这样的话\n我绝对能夺冠呢！
0000000000000,千奈,だってわたくしの先生は、世界一の\nプロデューサーですものっ！,因为我的老师是全世界\n最棒的制作人啊！
0000000000000,{user},（む、無垢な信頼が……眩しい……！）,（这、这份纯真的信赖……好耀眼……！）
0000000000000,{user},『N.I.A』で特に注目すべき\nプロデューサーはふたり。,『N.I.A』需要特别注意的\n制作人有两位。
0000000000000,千奈,ひとりは星南お姉さまですわね！\nふたりめはどなたでしょう？,一位是星南姐姐！\n另一位是谁呢？
0000000000000,{user},極月学園理事長にして、961プロ社長\nでもある黒井崇男氏です。,极月学园理事长兼961社长\n黑井崇男。
0000000000000,千奈,理事長で、社長で、プロデューサー……\nなのですか？,理事长、社长兼制作人……\n是这样吗？
0000000000000,{user},彼をプロデューサーと呼んでいいものか\n……国内有数の実績を持つ方、ですね。,不知能否称他为制作人……\n是国内首屈一指的实干家。
0000000000000,{user},得意な戦術は、豊富な資金力を活用した\nメディア展開で……,擅长运用雄厚资金进行\n媒体宣传的战术……
0000000000000,{user},『N.I.A』との相性は、すこぶる良い。,与『N.I.A』的适配度极高。
0000000000000,千奈,まぁ……強敵なのですね！　\n先生、わたくし、どうすれば――？,哎呀……是个强敌呢！\n老师，我该怎么办——
0000000000000,{user},たくさんテレビに出演しましょう。\n……お友達も一緒に。,多上电视节目吧。\n……带上你的朋友们一起。
0000000000000,千奈,えっ……て、テレビですのっ！？,诶……电、电视吗！？
0000000000000,{user},倉本さんは、バラエティ番組への高い\n適性があります。ですから……,仓本小姐在综艺节目方面\n有极高适应性。所以……
0000000000000,{user},極月学園と同じく『豊富な資金力を活用\nしたメディア展開』をしましょう。,和极月学园一样采用\n“雄厚资金媒体宣传”战术。
0000000000000,千奈,あの……先生？　それって、\n黒井社長がお得意だという……,那个……老师？这不是……\n黑井社长最拿手的……
0000000000000,{user},そう……今回はこちらも『N.I.A』と\nすこぶる相性の良い戦術を使います。,没错……这次我们也使用\n与『N.I.A』高度适配的战术。
0000000000000,{user},倉本グループフルコミットの……そう、\n961式プロデュース改をお見せしますよ。,让仓本集团全力配合……\n展示改良版961式培育法。
0000000000000,千奈,先生……そんな悪いお顔をしても\nわたくし騙されませんわ。,老师……就算摆出坏心眼的表情\n我也不会被骗哦。
0000000000000,千奈,断れない支援への対応……\nご負担をお掛けしますわね。,面对无法拒绝的支援……\n真是辛苦您了。
0000000000000,千奈,先生に報いるためにも……わたくし、\nテレビのお仕事をまっとうしますわ！,为了报答老师……\n我一定会认真完成电视工作！
info,adv_dear_kcna_011.txt,,
译者,Pro/deepseek-ai/DeepSeek-V3,,
