id,name,text,trans
0000000000000,あさり先生,紫雲さんの名字って\n珍しいと思いませんか？,紫云这个姓氏\n您不觉得很罕见吗？
0000000000000,あさり先生,この紫雲、実は名前だけじゃなくて\n他のことにも使われるんですが……,其实“紫云”这个词\n不仅用于人名还有其他用途……
0000000000000,あさり先生,意味はズバリ、紫の雲です。,它的含义直白地说就是紫色的云彩。
0000000000000,あさり先生,では、紫の雲とはどんなものでしょう？\nわかりますか？,那么，紫色的云象征着什么呢？\n您知道吗？
select,,めでたさの象徴,祥瑞的象征
select,,快活さの象徴,活泼的象征
select,,不穏の象徴,不祥的象征
0000000000000,あさり先生,正解です！\n先生は嬉しいですよー♪,答对了！\n老师很开心哦～♪
0000000000000,あさり先生,元は仏教からなんですが、\n紫はめでたさや高貴さの象徴です。,这个词源自佛教，\n紫色象征着祥瑞与高贵。
0000000000000,あさり先生,紫色の雲を見ることができれば、\n悟りを得ることができるとか。,据说如果能看见紫色的云彩，\n就能获得顿悟。
0000000000000,あさり先生,そんな感じで、紫雲さんの名字って\nおめでたいと同時に古風なんです。,所以紫云这个姓氏\n既寓意吉祥又充满古风韵味。
0000000000000,あさり先生,意外なギャップ、ですよね？,这种反差很有趣吧？
0000000000000,あさり先生,紫雲さんらしいですけど、\n今回は違いますね～。,虽然很有紫云同学的风格，\n但这次不太一样呢～。
0000000000000,あさり先生,紫の雲はめでたさの象徴です！,紫色云彩是祥瑞的象征哦！
0000000000000,あさり先生,紫が高貴な色で、それを見られるのは\nめでたい……という理由ですね。,因为紫色是高贵的颜色，能看见它\n本身就是件吉祥的事……
0000000000000,あさり先生,もちろん、紫が似合う快活な人も\nたくさんいます。,当然也有很多活泼的人\n很适合紫色呢。
0000000000000,あさり先生,色を選ぶときは、イメージに\n囚われすぎないようにしてくださいね。,选择颜色时不要太受\n固有印象束缚哦。
0000000000000,あさり先生,こら、名字にそんな言葉、\n使われないですよー。,喂喂，姓氏里才不会用\n这种词汇啦～
0000000000000,あさり先生,答えはめでたさの象徴です。\n仏教由来の言葉ですね。,正确答案是祥瑞的象征。\n这个说法源自佛教呢。
0000000000000,あさり先生,紫はもともと、いろんな文化で\n高貴な色とされてます。,紫色在很多文化中\n都被视为高贵的颜色。
0000000000000,あさり先生,高貴な色が見られるのはおめでたい。\nそんなふうに認識されたんですね。,能见到高贵的颜色本身就是吉兆。\n古人就是这么认为的。
0000000000000,あさり先生,つまり紫雲さんを見られるのは\nおめでたいこと！,也就是说能见到紫云同学\n就是件喜事！
0000000000000,あさり先生,……は、ちょっと飛躍しすぎですかね？,……这个说法是不是有点太夸张了？
info,adv_pevent_001_ssmk_school_007.txt,,
译者,Pro/deepseek-ai/DeepSeek-V3,,
