id,name,text,trans
0000000000000,{user},（倉本さんの様子を見に行こう）,（去看看仓本的情况吧）
0000000000000,千奈,ぜはーッ、ぜはーッ……,呼哈——呼哈——……
0000000000000,千奈,くるしぃですわぁ……とっても、\nとっても、くるしぃですわぁ……,好痛苦啊……真的、\n真的好痛苦啊……
0000000000000,{user},……これはひどい。,……这情况可不太妙。
0000000000000,千奈,わぁぁーっ！？　せ、先生！？　\n見ていらっしゃいましたの！？,哇啊！？老、老师！？\n您一直在看着吗！？
0000000000000,{user},はい……しばらく見せて\nもらいましたが……,是的……让我观察了\n一会儿……
0000000000000,{user},わかっていたこととはいえ、\n体力不足は深刻ですね。,虽然早有预料，\n但体力不足的问题确实很严重呢。
0000000000000,千奈,うぅ……申し訳ございませぇん。,呜呜……非常抱歉。
0000000000000,千奈,わたくし……ダンスの才能が\nないのでしょうか……？,莫非我……\n真的没有跳舞的才能吗……？
select,,トレーナーは\nどう思いますか？,训练师\n你怎么看？
select,,学園長はこう\n言っていました,学园长是这么\n说的
select,,まだわかりません,现在还不好说
0000000000000,ダンストレーナー,運動不足の中学生を教えたことが\nあるんだが。,我以前教过\n缺乏运动的中学生。
0000000000000,ダンストレーナー,だいたい同じような感触だ。,感觉和现在差不多。
0000000000000,千奈,わたくし高校生ですわーっ！？,我可是高中生呀——！？
0000000000000,ダンストレーナー,現時点で底辺なのは間違いない。\nしかし才能がないか、と聞かれたら……,目前基础差是事实。\n但要说有没有才能……
0000000000000,ダンストレーナー,どうだろうな？　普通じゃないか？\n鍛えればまだ伸びると思うぞ。,怎么说呢？很普通吧？\n好好锻炼的话还有成长空间。
0000000000000,{user},専門家は、こう言っていますが。\n不安は薄れましたか？,专家是这么说的。\n现在安心些了吗？
0000000000000,千奈,むむぅ……まだ才能をはかれる段階\nじゃないということですのね……,嗯嗯……就是说现在\n还不到判断才能的阶段对吧……
0000000000000,千奈,わかりましたわ！　わたくし、\n無心で努力いたします！,明白了！我会\n心无旁骛继续努力的！
0000000000000,{user},倉本さんと十王会長は、同じくらいの\n才能があると。,仓本同学和十王会长\n拥有同等程度的才能。
0000000000000,千奈,ええぇえぇ！？,诶诶诶——！？
0000000000000,千奈,わっ、わたくしに、星南お姉さまと\n同じ才能が眠っていますの！？,难、难道我体内沉睡着\n和星南姐姐相同的才能！？
0000000000000,ダンストレーナー,耄碌したんじゃないか？,老爷子糊涂了吧？
0000000000000,{user},その可能性もあります。,也有这种可能。
0000000000000,千奈,おふたりとも！　\nわたくしと学園長に失礼ですわ～っ！,两位！这样说我和学园长\n实在太失礼了——！
0000000000000,{user},学園長の審美眼が正しかったとしても、\n十王会長はアイドルとして、,就算学园长的眼光没错，\n十王会长作为偶像，
0000000000000,{user},膨大な経験を積み上げてきた。\nその結果、いまの彼女がある。,也是积累了庞大的经验。\n才有了现在的她。
0000000000000,千奈,……わかりますわ、\n先生が伝えようとしていること。,……我明白老师\n想告诉我什么了。
0000000000000,千奈,わたくしが、星南お姉さまのように、\n立派なアイドルになりたいのなら――,如果我想成为像星南姐姐那样\n出色的偶像——
0000000000000,千奈,たくさんの努力を積み上げて\nいかねばなりません！,就必须付出\n大量的努力才行！
0000000000000,千奈,始まったばかりで、弱音なんて\n漏らしてはいられませんわね！,这才刚刚开始，\n可不能就说丧气话呢！
0000000000000,{user},わかるのは、いまの倉本さんの\nダンスが未熟であることと……,目前能确定的是\n仓本同学的舞技还很稚嫩……
0000000000000,{user},出会った頃よりも、\n少し成長していることだけです。,以及比起初次见面时，\n有了些许进步。
0000000000000,千奈,……わたくし、成長していますの？,……我真的进步了吗？
0000000000000,{user},はい。ほんの少しだけ。,嗯。虽然只有一点点。
0000000000000,千奈,ほんの少しだけ、ですのね。,只有一点点呢。
0000000000000,千奈,構いませんわ。\n先生が、そう認めてくださった。,没关系的。\n只要老师您认可这点。
0000000000000,千奈,それだけで、力が湧いてきますもの。,光是这样
0000000000000,千奈,わたくし、この調子で少しずつ、\n前に進んでいきますわ！,我会保持这个节奏，\n一点一点继续前进的！
info,adv_pstory_001_kcna_after-step-2-normal-03.txt,,
译者,Pro/deepseek-ai/DeepSeek-V3,,
