id,name,text,trans
0000000000000,{user},そういえば、星南さんは寮ではなく\n実家から通っているんですよね。,说起来，星南同学你没有住宿舍\n而是从家里通勤的呢。
0000000000000,{user},寮に住もうと思ったことは\nないんですか？,从没考虑过\n住宿舍吗？
0000000000000,星南,他の子の話を聞いていると、\nたまにあるわ。,听其他孩子说起宿舍生活时，\n偶尔会闪过这个念头。
0000000000000,星南,プロデューサーとしては、\n寮に住んでほしいの？,作为制作人，\n你希望我住宿舍？
select,,聞いてみた\nだけです,只是\n随口问问
select,,試してみても\nいいのでは,或许可以\n尝试看看
select,,いい影響が\nあるなら,如果有积极\n影响的话
0000000000000,{user},星南さんが寮を歩いていたら、\n注目されっぱなしでしょうから。,要是星南同学在宿舍里走动，\n肯定会吸引所有人的目光吧。
0000000000000,星南,そうかしら。,会吗？
0000000000000,星南,どちらかというと……,要说的话……
0000000000000,星南,才能ある子たちが気になって\n私の気が散りそうだわ。,反而会忍不住关注那些有才华的后辈们，\n分散我的注意力呢。
0000000000000,{user},なにか発見があるかもしれませんし。,说不定会有意外收获哦。
0000000000000,星南,先輩がそういうなら、\n後学のために試してみようかしら。,既然前辈这么说，\n作为经验积累试试看也不错。
0000000000000,星南,ふふ……そのあかつきには\nことねを……,呵呵……到那时候\n把琴音也……
0000000000000,{user},（ご執心だな……）,（真是执着啊……）
0000000000000,{user},メリットがなさそうだったら、\n今のままのほうがいいですね。,如果没什么好处的话，\n还是维持现状比较好吧。
0000000000000,星南,ふふ。あくまで私のプロデュース\nのことを考えているのね。,呵呵。你始终在为我\n的偶像发展考虑呢。
0000000000000,{user},それはもちろん。,这是当然的。
0000000000000,星南,じゃあ、今日は寮ぐらしのメリットと\nデメリットを検討しましょうか。,那今天就来研讨\n宿舍生活的利弊吧。
info,adv_pevent_001_jsna_activity_012.txt,,
译者,Pro/deepseek-ai/DeepSeek-V3,,
