id,name,text,trans
0000000000000,広,プロデューサー。\n見た目をよくするってどうするの？,制作人。\n要怎么才能提升外在形象呢？
0000000000000,{user},……まず文脈を伺っても\nいいでしょうか？,……能不能先告诉我\n具体是什么情况？
0000000000000,広,レッスンで、ビジュアルを\n磨きましょうって言われた。,在训练课上，老师说要\n好好打磨视觉形象。
0000000000000,広,あんまり考えたことなかったから、\n教えてもらおうと思って。,我从来没仔细想过这个问题，\n所以想请教你。
select,,情報を\n集めましょう,收集\n信息
select,,見た目とは\n限りません,不局限于\n外表
select,,トレーナーを\n頼りましょう,向教练\n求助
0000000000000,{user},ビジュアルの研鑽は人それぞれ\nだといいます。,听说每个人提升视觉形象的方式\n都不尽相同。
0000000000000,{user},まずはリサーチからですね。\nこの後、街を歩いてみましょう。,先从调研开始吧。\n待会儿我们上街走走。
0000000000000,広,フィールドワークは苦手。\n最初はネットで探さない？,实地考察我不太擅长。\n一开始先上网查资料不行吗？
0000000000000,{user},体力づくりも兼ねてます。,顺便还能锻炼体力。
0000000000000,広,さすが、プロデューサー。\n倒れたらよろしく。,不愧是制作人。\n要是我累倒了就拜托你啦。
0000000000000,{user},アイドルにおけるビジュアルは、\nもっと広範囲です。,偶像的视觉形象\n涵盖范围更广。
0000000000000,{user},『好かれるポイント』とでも\n表現しましょうか。,或许可以称之为\n“讨人喜欢的特质”吧。
0000000000000,広,……好かれるポイント。\nまずはそれを探さなきゃ。,……讨人喜欢的特质。\n首先得找到这个才行。
0000000000000,広,プロデューサー、\nわたしのどこが好き？,制作人，\n你喜欢我哪一点？
0000000000000,{user},最初は教えてもらうのが\n一番です。,刚开始时听取他人意见\n是最有效的方法。
0000000000000,広,確かに。でもレッスンで\n教えてもらっても、わからなかった。,话是这么说。但训练课上\n老师教了我还是不明白。
0000000000000,{user},なら、次は？,那接下来怎么办？
0000000000000,広,……わかるまで教えてもらう。,……继续请教直到弄懂为止。
0000000000000,広,プロデューサー、ありがとう。,制作人，谢谢你。
info,adv_pevent_001_shro_activity_003.txt,,
译者,Pro/deepseek-ai/DeepSeek-V3,,
