id,name,text,trans
0000000000000,佑芽,広ちゃんはクリスマスパーティー、\nなに着るの～？　やっぱサンタ服？,小广打算在圣诞派对上\n穿什么呀～？果然是圣诞老人装？
0000000000000,広,クリスマスと言ったら、\nアグリーセーター。,说到圣诞节的话，\n当然是丑毛衣。
0000000000000,佑芽,なにそれ！　アグリーセーター……？\n初めて聞いた！,那是什么！丑毛衣……？\n第一次听说！
0000000000000,広,アグリーセーターは、クリスマスに\nちなんだものが編み込まれている\nセーターのこと。,丑毛衣就是与圣诞节\n相关的图案编织而成的\n毛衣。
0000000000000,広,今年はみんなで着たくて準備してきた。\n――はい、これ。,今年特意准备让大家一起穿。\n——来，这件给你。
0000000000000,広,面白ければ面白いほど正装。\nダサいのが基本と言われている。,越有趣越正式。\n越土气越符合基本要求。
0000000000000,佑芽,こういうセーター見たことある！\nすっっごくにぎやかで可愛いぃ～！,我见过这种毛衣！\n超热闹超可爱的～！
0000000000000,佑芽,サンタさんとトナカイが付いてるなんて\n確かに面白いね！,居然有圣诞老人和驯鹿图案\n确实很有趣呢！
0000000000000,広,頑張って……初めて、編み物した。,这是我第一次……尝试编织。
0000000000000,佑芽,編んだって、広ちゃんが……？,你说这是你自己织的……？
0000000000000,広,そう。難しかった。\n…………止めどきが。,嗯。很难掌握收尾的时机。\n…………收针的技巧。
0000000000000,佑芽,んん？　編むのが、じゃなくて？,嗯？不是说编织本身难吗？
0000000000000,広,そう。編み物は止めどきが難しい。\n終わりがあるようでない。,不。编织最难的是收针。\n看似有终点实则没有尽头。
0000000000000,広,気がついたら、<r\=ディカプルエックスエル>XXXXXXXXXXL</r>の\nセーターになってた。,回过神来已经织成了XXXXXXXXXXL号\n的毛衣。
0000000000000,佑芽,そ、そんなサイズ、初めて聞いたよ！？,这、这种尺码还是第一次听说！？
0000000000000,広,止めどきが難しいなんて。ふふ。\n編み物もわたしに向いていない。,没想到收针这么难。呵呵。\n看来编织也不适合我。
0000000000000,佑芽,そんなことないよ！　上手だもん。\nさすが広ちゃんだな～！,才没有！明明织得很好呀。\n不愧是小广～！
0000000000000,佑芽,あ！　あたし、サンタ帽やつけヒゲとか\nトナカイカチューシャ持ってるよ！,啊！我有圣诞帽、假胡须\n还有驯鹿头饰哦！
0000000000000,佑芽,このセーターと組み合わせたら、\n賑やかさが増していいと思わない？,要是和这件毛衣搭配起来\n肯定会更热闹吧？
0000000000000,広,ふふ……いいね。\nこれ着て千奈をびっくりさせよう。,呵呵……不错呢。\n我们就穿着这个去吓千奈一跳吧。
info,adv_csprt-2-0035_01.txt,,
译者,Pro/deepseek-ai/DeepSeek-V3,,
