id,name,text,trans
0000000000000,千奈,うむむむ…………\nこれは難しい問題ですわ……,唔唔唔…………\n这真是个难题呢……
0000000000000,佑芽,千奈ちゃん、なにか悩みごと？,小千奈，你在烦恼什么吗？
0000000000000,広,……聞かせてほしい。\n千奈の助けになれるかも。,……请告诉我们。\n或许能帮上忙。
0000000000000,千奈,花海さん、篠澤さん……\nありがとうございます。,花海同学，筱泽同学……\n非常感谢你们。
0000000000000,千奈,実は――,其实是——
0000000000000,千奈,いつもお世話になっている先生に\n恩返しをしたいのです！,想向一直关照我们的老师\n报恩！
0000000000000,佑芽,いまさらだけど、千奈ちゃんって\nプロデューサーさんのことを、,现在才注意到，千奈酱你\n原来一直把制作人先生
0000000000000,佑芽,先生って、呼ぶんだね？,称作“老师”呢？
0000000000000,千奈,はいっ！　わたくし、どうしても\nそうお呼びしたくって！,是的！我无论如何\n都想这样称呼！
0000000000000,広,ふふ、いつも千奈を気遣っている……\nいい目をしたひと。,呵呵，总是那么关心千奈……\n是个眼神温柔的人呢。
0000000000000,佑芽,千奈ちゃんのことが大好きで、\n熱意溢れるプロデュースをするひと。,超级喜欢千奈酱，\n充满热情的培育者。
0000000000000,佑芽,よーくしってるよ！　ねっ、広ちゃん。,我们很了解哦！对吧小广？
0000000000000,広,うん、わたしたちも\n色々お世話になってるし……,嗯，我们也\n经常受他照顾……
0000000000000,広,千奈との会話を、\n毎日のように見せられてるから。,毕竟每天都能看到\n千奈和老师的对话呢。
0000000000000,佑芽,千奈ちゃんがいっつも、\n素敵な先生ですわ――って、,因为千奈酱总是\n“我家老师最棒了——”
0000000000000,佑芽,幸せそうに惚気てるから。,这样幸福地炫耀着呢。
0000000000000,千奈,のっ……惚気だなんて……そんな！,才、才没有炫耀…………！
0000000000000,千奈,花海さんったら、もうっ！　もうっ！,花海同学真是的！讨厌！
0000000000000,千奈,恥ずかしいですわ～～～～～～～！,太让人害羞了啦～～～～～！
0000000000000,広,……落ち着いた？,……冷静下来了吗？
0000000000000,千奈,はい……つい、\n興奮しすぎてしまいましたわ。,是……不小心\n太激动了。
0000000000000,広,わかる。わたしも、毎日過酷な試練を\n与えてくるひとのことを考えると……,我懂。每次想到那个每天\n给我们严苛训练的人……
0000000000000,広,どきどきしちゃうから。,也会心跳加速呢。
0000000000000,佑芽,えっ、広ちゃん誰のこと？,诶？小广说的是谁？
0000000000000,広,トレーナー。,训练员。
0000000000000,佑芽,広ちゃんトレーナーさんたちのこと\n大好きだよねぇ……,小广果然最喜欢\n训练员们了呢……
0000000000000,広,わたし、アイドルになってから……\n毎日のように、,自从成为偶像后……\n每天
0000000000000,広,色んなひとに、お世話になってる。\n千奈の気持ち……わかるよ。,一直以来 受到很多人的关照。\n千奈的心情……我懂的。
0000000000000,佑芽,あたしも……わかるな。,我也……深有体会。
0000000000000,佑芽,すっごく、すっごく……\nお世話になっているひとが、いるから。,因为有位非常、非常……\n照顾我的人。
0000000000000,佑芽,千奈ちゃん！　一緒に考えよう！　\nどんな恩返しをしたらいいか！,千奈酱！我们一起想！\n该怎么报恩！
0000000000000,広,一緒に悩んで、苦しもう。,一起烦恼，一起痛苦吧。
0000000000000,千奈,花海さん！　篠澤さん！,花海同学！筱泽同学！
0000000000000,千奈,わたくし、素敵なお友達を\n持ちましたわ……！,能遇到你们这样的挚友\n我真是太幸福了……！
0000000000000,千奈,共に考えましょう！　最高の恩返しを！,一起思考吧！最棒的报恩方式！
info,adv_cidol-kcna-3-005_01.txt,,
译者,Pro/deepseek-ai/DeepSeek-V3,,
