id,name,text,trans
0000000000000,麻央,ああ、お内裏様。あなたはどうして\nお内裏様なの？　……ふふ。,啊啊，天皇陛下。为什么您会成为\n天皇陛下呢？……呵呵。
0000000000000,手毬,――有村先輩。\nここにいたんですね。,——有村前辈\n原来您在这里啊。
0000000000000,麻央,……手毬。もしかして、探してた？　\nごめん。台本のチェックをしていてね。,……手毬。难道在找我吗？\n抱歉，我刚才在核对剧本。
0000000000000,麻央,少し、アドリブを入れてみるのも\nいいかなって。手毬はどう思う？,想着要不要加点即兴发挥。\n手毬觉得呢？
0000000000000,手毬,あの、有村先輩……,那个，有村前辈……
0000000000000,手毬,やっぱり……先輩が、お内裏様の役、\nやりたかったですよね。,果然……前辈其实很想演\n天皇陛下的角色对吧？
0000000000000,麻央,……――,……——
0000000000000,麻央,……まあ、ね。,……算是吧。
0000000000000,麻央,最初に演劇のお仕事って聞いて、\n期待したのは間違いないよ。,最初听说有戏剧工作时，\n确实对这个角色有所期待。
0000000000000,麻央,でも、求められたことに\n応えるのがボクたちの仕事だから。,但回应委托人的需求\n才是我们的工作啊。
0000000000000,麻央,引き受けた以上は、全力で\n自分の仕事をまっとうするだけさ。,既然接下了工作，\n就要全力以赴完成自己的职责。
0000000000000,手毬,有村先輩は、それでいいんですか？,前辈真的甘心接受这样的安排吗？
0000000000000,麻央,……ああ。手毬の気遣いは、\nとても嬉しいけど――,……嗯。虽然很感谢手毬的关心——\n不过没问题啦。
0000000000000,麻央,大丈夫だよ。,没关系的。
0000000000000,麻央,手毬はお内裏様、ボクはお雛様で、\n一緒にステージを盛り上げよう。,手毬演天皇陛下，我演雏人偶，\n一起让舞台热闹起来吧。
0000000000000,手毬,……はい！,……好的！
0000000000000,手毬,えっと、有村先輩。,那个，有村前辈。
0000000000000,麻央,……ん？,……嗯？
0000000000000,手毬,私、歌は誰よりも上手いんですけど、\n演技はあまり自信がなくて――,虽然我唱歌比谁都拿手，\n但对演戏没什么自信——
0000000000000,手毬,なにかコツとかあれば、\n演技指導、してもらえますか？,能请您指导我\n一些表演技巧吗？
0000000000000,麻央,……ああ、ボクでよければ。,……啊，只要你不嫌弃的话。
0000000000000,麻央,台詞は、もう完璧だね？,台词已经全部记熟了吧？
0000000000000,手毬,全部、頭に入ってます。,全都记在脑子里了。
0000000000000,麻央,ふふ、さすが手毬だね。\nそれじゃあ、そこに立ってみて。,呵呵，不愧是手毬呢。\n那先站到那边去吧。
0000000000000,麻央,ボクの子役時代の経験、\n教えられるだけ、教えてあげる。,我会把童星时期的经验\n都教给你。
0000000000000,手毬,ああっ！　なんということだ！\nお雛様の首がああああっ――,啊啊啊！怎么会这样！\n雏人偶的头啊啊啊——
0000000000000,麻央,まだ恥ずかしがってるね。\n羞恥心は捨てて。もう一度。,还是放不开呢。\n把羞耻心丢掉。再来一次。
0000000000000,手毬,お、お雛様の首がああああっ！\nぎゃああああああっ！,雏、雏人偶的头啊啊啊！\n呀啊啊啊啊啊！
0000000000000,麻央,うん、いいよ。手毬は姿勢がいいから、\n所作が美しく見えるね。,嗯，不错。手毬的仪态很好，\n动作看起来很优美呢。
0000000000000,麻央,次は歩き方。あまり力まずに、\n自然体で歩いてみて。,接下来是走路姿势。别太用力，\n用自然的姿态走走看。
0000000000000,手毬,こ、こうですかっ！？,这、这样吗！？
0000000000000,麻央,……固いな。ボクの歩き方、\nよく見ていて。,……太僵硬了。\n仔细看我的走法。
0000000000000,手毬,……すごい。私のと全然違う……！,……好厉害。和我的完全不一样……！
0000000000000,麻央,さ、やってみて。\nうん……いいね。その調子だよ。,来，试试看。\n嗯……很好。保持这样。
0000000000000,手毬,はぁ、はぁ……あ、\nありがとうございましたっ！,哈啊，哈啊……\n非、非常感谢！
0000000000000,麻央,ふふ、どういたしまして。,呵呵，不用谢。
0000000000000,麻央,それにしても、驚いたよ。\n本当にのみ込みが早いね。,不过真是让人吃惊呢。\n领悟得真快。
0000000000000,麻央,しっかり稽古すれば、役者の仕事も\nできるんじゃないかな。,好好练习的话，\n说不定也能当演员哦。
0000000000000,手毬,それって、私に女優の\n才能もあるってことですか？,这是说我也有\n当女演员的才能吗？
0000000000000,麻央,……え？,……诶？
0000000000000,麻央,ああ、そうだね。手毬のメンタルは、\nけっこう役者向きかも。,啊，是啊。手毬的心理素质\n其实挺适合当演员的。
0000000000000,手毬,女優業もこなすクール系のアイドル。\n……うん、悪くないかも。,兼具女演员身份的冷系偶像。\n……嗯，感觉还不错呢。
0000000000000,麻央,手毬はボクより背も高いし、\n舞台映えすると思うよ。,手毬比我还高挑，\n我觉得很适合舞台效果哦。
0000000000000,手毬,有村先輩……,有村前辈……
0000000000000,麻央,……？,……？
0000000000000,手毬,……私、やっぱり、有村先輩の\nお内裏役が見てみたい……です。,……其实我更想看看\n有村前辈饰演天皇陛下的样子……
0000000000000,麻央,手毬……,手毬……
0000000000000,手毬,だって、こんなにも演劇への\n想いがあって――,因为您对戏剧\n怀着如此热忱——
0000000000000,手毬,男の人の役の演じ方も\n知り尽くしてる。,连男性角色的演绎方式\n都了如指掌。
0000000000000,手毬,有村先輩がお内裏様のほうが、\n絶対、お客さんも楽しめると思うし。,如果由有村前辈来演天皇，\n观众们肯定会更享受的。
0000000000000,手毬,あ、お雛様役の有村先輩だって、\n可愛いと思うんですけど……,啊、当然前辈演雏偶小姐\n也很可爱就是了……
0000000000000,麻央,いや、ボクは――,不，我——
0000000000000,千奈,ふっふっふ……\n話は聞かせてもらいましたわっ！,呵呵呵……\n你们的对话我都听到了哦！
0000000000000,麻央,……千奈？,……千奈？
0000000000000,手毬,い、いつからいたの！？,你、你什么时候来的！？
0000000000000,千奈,おふたりが練習してるところ、\nずっと見ていましたわっ！,从两位开始排练时\n我就在观摩了哦！
0000000000000,千奈,わたくし、月村さんのお内裏様も\nよいと思いますし、,我认为月村小姐饰演天皇\n固然很合适，
0000000000000,千奈,でも、麻央先輩のお内裏様も\nとーっても見てみたいですの。,但麻央前辈的天皇扮相\n人家也超级想看呢。
0000000000000,千奈,だからわたくし、\n考えましたの――,所以我，\n认真思考了——
0000000000000,千奈,リバーシするのがよいと思いますわ！,用黑白棋来决定吧！
0000000000000,麻央,……リバーシ？,……黑白棋？
0000000000000,千奈,はい。先ほどの練習で、麻央先輩は、\nお内裏様の台詞を覚えていましたわ。,是的。刚才排练时，麻央前辈\n已经记住了天皇的台词呢。
0000000000000,麻央,……まあ、一応ね。\n当日に何があるかわからないし。,……算是吧。\n毕竟不知道正式演出会出什么状况。
0000000000000,千奈,月村さんも、お雛様の台詞、\n結構覚えていましたわね？,月村小姐也把雏偶的台词\n记得挺熟了呢？
0000000000000,手毬,まあ、何かあったら、\nそっちもできるようにね。,嗯，为了应对\n可能发生的状况嘛……
0000000000000,麻央,もしかして、ボクと代わるために？,难道是为了和我换角准备的？
0000000000000,手毬,そ、そんなに多い台詞量じゃ、\nないですし……,这、这样的台词量，\n也没那么多……
0000000000000,千奈,でしたら、午前の部と午後の部で、\n配役を逆パターンにできますわ。,既然如此，上午场和下午场\n可以交换角色来演哦。
0000000000000,手毬,ああ、リバーシって、\nそういうこと。,啊，这就是你说的\n黑白棋方案啊。
0000000000000,千奈,月村さんが、午後までにお雛様の\n台詞を完璧に覚えられれば――,只要月村小姐能在下午场前\n完美记住雏偶台词——
0000000000000,手毬,……できるよ。\n私、女優だから。,……没问题。\n我可是专业演员。
0000000000000,千奈,では、問題ありませんわね。,那就这么定了吧。
0000000000000,千奈,話題作りにもなりますし、お客様も、\n両方楽しめて良いことずくめですわ！,既能制造话题，观众也能\n享受双重乐趣，一举两得呢！
0000000000000,麻央,ま、待って！　そんなの、\n勝手にして大丈夫なのかい？,等、等等！这样擅自决定\n真的没问题吗？
0000000000000,千奈,先方はある程度、自由にしていいと\n仰っていますし――,主办方说过可以\n适当自由发挥——
0000000000000,千奈,わたくし、運営の方に\nかけあってみますわ！,人家这就去和运营方\n沟通看看！
0000000000000,手毬,ふふ、頼りになるじゃん、\nぽんこつ。,呵呵，还挺可靠的嘛\n小笨蛋。
0000000000000,千奈,ふふ、おまかせください、ですわ！,呵呵，请交给我吧！
0000000000000,手毬,それじゃあ、決まりだね――,那就这么定了——
0000000000000,手毬,……有村先輩、お内裏様のお手本、\n見せてくれますか？,……有村前辈，能给我示范下\n天皇的演绎方式吗？
0000000000000,麻央,……わかった。\nありがとう、手毬。千奈。,……明白了。\n谢谢你们，手毬。千奈。
info,adv_event_011_main-04.txt,,
译者,Pro/deepseek-ai/DeepSeek-V3,,
