id,name,text,trans
0000000000000,{user},今日のイベントでは映画を見て、\nその感想を話していただきます。,今天的活动是看电影后\n请大家分享观后感。
0000000000000,広,アイドルを目指す女の子の話なんだ……,是关于立志成为偶像的女孩的故事呢……
0000000000000,広,ただ感想を言うだけでいいの？,只要简单说说感想就可以了吗？
select,,素直な篠澤さんの\n感想を,希望听到最真实的\n篠泽同学的感想
select,,同じ立場としての\n感想を,以同样追梦者的身份\n分享的感想
select,,エピソードを\n交えて,如果能结合\n自身经历
0000000000000,広,わかった。\n素直に思ったことを、話してくる。,明白了。\n我会把内心真实的想法说出来的。
0000000000000,{user},感慨深い気持ちになる、\n良い感想だったな……,真是令人感慨万千\n非常棒的感想呢……
0000000000000,広,同じ……うん。アイドルを目指す\nひとりとして、話してくる、ね。,同感……嗯。作为一个正在追逐\n偶像梦想的人，这样分享很自然呢。
0000000000000,{user},感慨深い気持ちになる、\n良い感想だったな……,真是令人感慨万千\n非常棒的感想呢……
0000000000000,広,エピソードはたくさんある。\nアイドルを目指す日々は、楽しいから。,有很多故事可以分享。\n因为追逐偶像梦想的每一天都很开心。
0000000000000,{user},感慨深い気持ちになる、\n良い感想だったな……,真是令人感慨万千\n非常棒的感想呢……
info,adv_pevent_002_shro_sales_4-004-02.txt,,
译者,Pro/deepseek-ai/DeepSeek-V3,,
