id,name,text,trans
0000000000000,{user},お疲れ様でした。咲季さんは……,辛苦了。咲季小姐你……
0000000000000,{user},合格です。まずまずの結果でしたね。,合格了。算是还不错的成绩呢。
0000000000000,咲季,このくらいの順位なのね……\nむむむ……,排在这个名次啊……\n唔唔……
0000000000000,咲季,……………………………………,……………………………………
0000000000000,{user},咲季さん？,咲季小姐？
0000000000000,咲季,ん？　あ、ゴメン。考え事してた。,嗯？啊、抱歉。我在想事情。
select,,順位を伸ばす\n方法ですか？,是在考虑提升排名\n的方法吗？
select,,昔を思い出し\nましたか？,是想起\n以前的事了吗？
select,,妹のことですか？,是在想妹妹的事吗？
0000000000000,咲季,まぁね。,算是吧。
0000000000000,咲季,この調子でやっていけば、\nまだまだ伸ばせそう――,照这个势头继续努力的话，\n应该还能更进一步——
0000000000000,咲季,――と、思うんだけど……どう思う？,——我是这么觉得的……你怎么看？
0000000000000,{user},咲季さんが自分で思っているよりも\nずっと……,咲季小姐比自己认为的\n还要……
0000000000000,{user},伸びしろは残っていますよ。,远比你自己想象的还要大哦。
0000000000000,咲季,……お見通しね。\nその言葉を信じるわ、プロデューサー。,……被你看穿了呢。\n我就相信你这句话吧，制作人。
0000000000000,咲季,……ぬぐ、鋭いわね。そのとおりよ。,……哼，眼光挺准嘛。你说得对。
0000000000000,咲季,今回の順位……参加人数を考えると、\n中の上～上の下ってところかしら。,这次的名次……考虑到参赛人数，\n大概算是中上到上下水平吧。
0000000000000,咲季,どんな競技でも、ここまでは\n到達するのよね――,不论什么比赛，\n我都能达到这个阶段——
0000000000000,咲季,だから、ここからよ。\nここがわたしの、本当のスタート。,所以从现在开始才是重点。\n这才是我真正的起点。
0000000000000,咲季,ここからアイドルとして\n伸びてみせるわ。必ずね。,我要从这里开始\n作为偶像绽放光芒。一定会的。
0000000000000,咲季,…………なんでわかるのよ。,…………为什么你会知道啊。
0000000000000,{user},咲季さんが妹を想っていない\n瞬間なんて、ないでしょう。,因为咲季小姐无时无刻\n不在想着妹妹吧。
0000000000000,咲季,そういう言い方をされると、まるで\nわたしがシスコンみたいじゃない。,被你这么一说，\n搞得我像是个妹控似的。
0000000000000,咲季,勘違いしないで。わたしはただ、\nあの子のお姉ちゃんとして――,别误会。\n我只是作为那孩子的姐姐——
0000000000000,咲季,この順位じゃ自慢できないと\n思っただけ。,觉得这种名次\n根本拿不出手而已。
0000000000000,咲季,別にシスコンじゃないんだからねっ！,才不是因为我是妹控呢！
info,adv_pstory_001_hski_after-audition-mid-normal-03.txt,,
译者,Pro/deepseek-ai/DeepSeek-V3,,
