id,name,text,trans
0000000000000,麻央,プロデューサー？\nこんなに朝早くからどうしたんですか？,制作人？\n这么一大早过来有什么事吗？
0000000000000,麻央,寮の前でうろうろしていたら、\n後輩の子に不審がられちゃいますよ。,要是在宿舍门口晃来晃去的话\n会被后辈们当成可疑人物的哦。
0000000000000,{user},では見つからないうちに、これを。\nまた腕をひねられるのは困りますから。,所以要在被发现前把这个给你。\n我可不想再被扭住胳膊了。
0000000000000,麻央,？　これ、ケーキ……ですか？\nもしかして――,？这个是蛋糕……？\n难道说——
0000000000000,{user},部屋でゆっくり食べてください。\n誕生日おめでとうございます。,请慢慢在房间里享用吧。\n生日快乐。
0000000000000,麻央,わざわざこのために……\nふふっ、ありがとうございます。,特意为了我……\n呵呵，谢谢您。
info,adv_startup_2025_bd-01_amao-01.txt,,
译者,Pro/deepseek-ai/DeepSeek-V3,,
