id,name,text,trans
0000000000000,{user},試飲の案内の仕事ですが……\n葛城さん、抹茶は知っていますか？,关于试饮推广的工作……\n葛城同学，你了解抹茶吗？
0000000000000,リーリヤ,お茶会でたまに飲んでました。\nスウェーデンでも人気なんですよ？,在茶会上偶尔会喝到。\n在瑞典也很受欢迎哦？
select,,それなら心配\nいらないですね,那就不用担心了\n没问题呢
select,,商品は\n飲みました？,商品\n尝过了吗？
select,,いい売り文句\nですね,很不错的\n推销词呢
0000000000000,リーリヤ,そ、それより声をかけるのが……\n早く慣れたいです……。,比、比起这个主动搭话……\n好想快点习惯起来……
0000000000000,{user},スウェーデンの話を活かしたトークで\n売上に貢献できたみたいだ。,看来用瑞典相关的聊天话题\n为销售额做出了贡献呢
0000000000000,リーリヤ,はい。お茶会で飲んだものに\n比べて少し苦かったです……,是的。不过比起茶会上喝到的\n这个稍微有点苦……
0000000000000,{user},スウェーデンの話を活かしたトークで\n売上に貢献できたみたいだ。,看来用瑞典相关的聊天话题\n为销售额做出了贡献呢
0000000000000,リーリヤ,スウェーデンでも人気のところですか？\nお客さんに話してみようかな……。,这个在瑞典也很受欢迎吗？\n要不试着和客人聊聊看……
0000000000000,{user},スウェーデンの話を活かしたトークで\n売上に貢献できたみたいだ。,看来用瑞典相关的聊天话题\n为销售额做出了贡献呢
info,adv_pevent_002_kllj_sales_1-005-02.txt,,
译者,Pro/deepseek-ai/DeepSeek-V3,,
